Railroad_Name,Reporting_Marks,State,Route_Miles,Class_I_BNSF,Class_I_UP,Class_I_CSX,Class_I_NS,Class_I_CN,Class_I_CPKC,Primary_Commodities,Transload,Unit_Train,Special_Capabilities,Website
Alabama Southern Railroad,ABS,"AL, MS",85,N,N,N,"Birmingham, AL","Columbus, MS",N,"Energy products, Steel, Paper, Roofing materials, Grain, Chemicals",N,N,KCS lease operations,https://www.watco.com/service/rail/alabama-southern-railroad-abs/
Alabama Warrior Railway,ABWR,AL,15,N,N,"Birmingham, AL","Birmingham, AL",N,N,"Coal, Aggregates, Pipe, Scrap steel, Cement",N,N,Walter Industries plant operations,https://www.watco.com/service/rail/alabama-warrior-railway-abwr/
Agawa Canyon Railroad,ACR,ON,244.5,N,N,N,N,"Oba, ON",N,"Forest products, Paper, Mining products, Tourism",N,N,Passenger excursion train operations,https://www.watco.com/service/agawa-canyon-railroad-acr/
Ann Arbor Railroad,AA,"MI, OH",83,N,N,"Toledo, OH","Toledo, OH","Connection",N,"Automotive parts, Chemicals, Plastics, Grain",N,N,State-owned track operations,https://www.watco.com/service/rail/ann-arbor-railroad-aa/
Arkansas Southern Railroad,ARS,AR,N/A,Y,Y,N,N,N,N,"Forest products, Agricultural products",N,N,Regional short line operations,https://www.watco.com/service/watco-railroads/
Austin Western Railroad,AWRR,TX,190,N,"McNeil, TX",N,N,N,N,"Aggregates, Limestone, Lumber, Beer, Chemicals, Plastics, Paper",N,N,Shared track with Austin commuter rail,https://www.watco.com/service/rail/austin-western-railroad-awrr/
Autauga Northern Railroad,AUT,AL,43.62,N,N,N,"Connection",N,N,"Paper products, Forest products, Pulp",N,N,NS lease operations,https://www.watco.com/service/watco-railroads/
Baton Rouge Southern Railroad,BRS,LA,1.5,N,N,N,N,N,"Baton Rouge area",Chemicals,N,N,Louisiana Chemical Corridor operations,https://www.watco.com/service/rail/baton-rouge-southern-railroad-brs/
Birmingham Terminal Railway,BHRR,AL,76.1,"Birmingham, AL",N,"Birmingham, AL","Birmingham, AL",N,N,"Steel products, Coal, Industrial materials",N,N,Terminal switching services,https://www.watco.com/service/rail/birmingham-terminal-railway-bhrr/
Blue Ridge Southern Railroad,BLU,NC,N/A,N,N,Y,"Connection",N,N,"Wood chips, Paper, Plastics, Cement, Coal, Epsom salt products",N,N,Forest products specialization,https://www.watco.com/service/rail/blue-ridge-southern-railroad-blu/
Boise Valley Railroad,BVRR,ID,70.76,N,"Caldwell, Nampa",N,N,N,N,"Potatoes, Lumber, Fertilizer, Fuels",N,N,Dual branch operations,https://www.watco.com/service/rail/boise-valley-railroad-bvrr/
Cicero Central Railroad,CERR,IL,N/A,"Chicago area",Chicago area,Chicago area,Chicago area,N,N,"Pitch, Chemicals for plastics, Plastics",N,N,Chemical industry specialization,https://www.watco.com/service/rail/cicero-central-railroad-cerr/
Decatur & Eastern Illinois Railroad,DREI,IL,N/A,N,Illinois connections,N,"Decatur, IL","Connection",N,"Grain, Ethanol, Agricultural products",N,Y,Agricultural commodity specialization,https://www.watco.com/service/rail/decatur_and_eastern_illinois/
Dutchtown Southern Railroad,DUSR,LA,1.76,N,N,N,N,"Geismar, LA",N,"Chemicals, Plastics, Gas and energy products",N,N,Chemical industry specialization,https://www.watco.com/service/rail/dutchtown-southern-railroad/
Eastern Idaho Railroad,EIRR,ID,365.17,N,"Idaho Falls, Minidoka",N,N,N,N,"Potatoes, Grain, Agricultural products",N,N,Dual segment operations,https://www.watco.com/service/rail/eastern-idaho-railroad-eirr/
Elwood Joliet & Southern Railroad,EJSR,IL,1.2,"Chicago area","Chicago area",N,N,N,Chicago area,"Plastics, Chemicals, Grain, Scrap metal, Sodium carbonate",N,N,Industrial switching services,https://www.watco.com/service/rail/elwood-joliet-and-southern-railroad-ejsr/
Geaux Geaux Railroad,GOGR,LA,26,N,N,N,N,"Baton Rouge area","Baton Rouge area","Chemicals, Agricultural products",N,N,Louisiana Chemical Corridor operations,https://www.watco.com/service/watco-railroads/
Grand Elk Railroad,GDLK,"IN, MI",123,N,N,"Grand Rapids, MI","Elkhart, Kalamazoo","Kalamazoo, MI",N,"Frac sand, Plastics, Metals, Forest products, Aggregates",N,N,Upper Peninsula Michigan expansion,https://www.watco.com/service/rail/grand-elk-railroad-gdlk/
Great Lakes Central Railroad,GLC,MI,900,N,N,Y,Y,"Connection","Connection","Agricultural products, Plastics, Oil and gas, Chemicals",N,N,$3.7M Watco investment planned,https://www.watco.com/service/rail/great-lakes-railroad-glc/
Great Northwest Railroad,GRNW,"WA, ID",87.1,"Ayer Junction, WA","Ayer Junction, WA",N,N,N,N,"Forest products, Agricultural products, Chemicals, Scrap iron, Frozen vegetables",N,N,Former Camas Prairie Railroad operations,https://www.watco.com/service/rail/great-northwest-railroad-grnw/
Jacksonville Port Terminal Railroad,JXPT,FL,10,N,N,"Jacksonville, FL","Jacksonville, FL",N,N,"Automobiles, Chemicals, Farm products, Intermodal, Pulp and paper",Y,N,Port terminal operations,https://www.watco.com/service/rail/jacksonville-port-terminal-railroad-jxpt/
Kanawha River Railroad,KNWA,"WV, OH",359.12,N,N,N,"Columbus, OH; Charleston, WV",N,N,"Coal, Chemicals, Cement, Aggregates, Metals",N,N,Heavy coal train operations,https://www.watco.com/service/rail/knwa/
Kansas & Oklahoma Railroad,KO,"KS, OK","N/A","Connection","Connection",N,N,N,N,"Grain, Chemicals, LPG",N,Y,Agricultural commodity handling,https://www.watco.com/service/rail/kansas-and-oklahoma-railroad-ko/
Kaw River Railroad,KAW,KS,N/A,"Connection",Connection,N,N,N,N,"Grain, Agricultural products",N,Y,Kansas Kaw River valley operations,https://www.watco.com/service/watco-railroads/
Louisiana Southern Railroad,LAS,LA,157,N,N,N,N,N,"Connection","Forest products, Paper, Agricultural products, Chemicals",N,N,Disconnected route operations,https://www.watco.com/service/watco-railroads/
Mission Mountain Railroad,MMT,MT,26,"Connection",N,N,N,N,N,"Forest products, Grain",N,N,Northwestern Montana operations,https://www.watco.com/service/rail/mission-mountain-railroad-mmt/
Mississippi Southern Railroad,MSR,MS,N/A,N,N,N,"Connection","Connection","Connection","Forest products, Paper, Agricultural products, Chemicals",N,N,Mississippi corridor operations,https://www.watco.com/service/watco-railroads/
Palouse River & Coulee City Railroad,PCC,WA,300,"Connection","Connection",N,N,N,N,"Wheat, Lentils, Barley",N,N,State-owned railroad system,https://www.watco.com/service/rail/palouse-river-coulee-city-railroad-pcc/
Pennsylvania Southwestern Railroad,PSWR,PA,10.5,N,N,Pittsburgh area,"Plant boundaries",N,N,"Steel scrap, Steel products",N,N,Industrial plant railroad operations,https://www.watco.com/service/rail/pennsylvania-southwestern-railroad-pswr/
Savannah & Old Fort Railroad,SVHO,GA,6.5,N,N,"Savannah, GA","Savannah, GA",N,N,"Sulfuric acid, Sulfur, Gypsum, Pulpboard, Wood pellets, Petroleum",N,N,Hazmat handling capabilities,https://www.watco.com/service/rail/savannah-old-fort-svho/
Smoky Ridge Railroad,SMO,TN,13.7,N,N,N,"Blair, TN",N,N,"Nuclear materials, Research materials, Government cargo",N,N,DOE facility access,https://www.watco.com/service/watco-railroads/
South Kansas & Oklahoma Railroad,SKOL,"KS, OK",N/A,"Connection","Connection",N,N,N,N,"Grain, Agricultural products, Oil and gas products",N,Y,Multi-state operations,https://www.watco.com/service/rail/skol/
Stillwater Central Railroad,SLWC,OK,275,"Sapulpa, Tulsa, OKC, Snyder","Midwest City, OK",N,N,N,N,"Fuels, Minerals, Industrial products",N,N,Multiple Class I connections,https://www.watco.com/service/rail/stillwater-central-railroad-slwc/
Timber Rock Railroad,TIBR,"TX, LA",160,"Connection",Connection,N,N,N,Louisiana connections,"Forest products, Paper, Wood products",N,N,Forest products specialization,https://www.watco.com/service/watco-railroads/
Verdigris Southern Railroad,VESO,OK,3,N,"Connection",N,N,N,N,"Raw pulp, Paper products",N,N,Port facility operations,https://www.watco.com/service/rail/verdigris-southern-railroad-veso/
Vicksburg Southern Railroad,VSOR,MS,36.58,N,N,N,N,N,"Vicksburg, MS","Energy products, Paper products, Coal",N,N,Former IC mainline operations,https://www.watco.com/service/rail/vicksburg-southern-railroad-vsor/
Wisconsin & Southern Railroad,WSOR,"WI, IL",837,"Connection","Connection","Chicago via Metra","Chicago via Metra","Connection","Connection","Agricultural products, Manufactured goods, Food products",N,Y,All 6 Class I connections,https://www.watco.com/service/rail/wsor/
Yellowstone Valley Railroad,YSVR,"MT, ND",170,"Multiple (owns line)",N,N,N,N,N,"Natural gas, Crude oil, Frac sand",N,N,Energy industry specialization,https://www.watco.com/service/watco-railroads/
