HS6,HS4,HS2,Description
732181,7321,73,"OTHER PORTABLE DOMESTIC APPLIANCES OF IRON OR STEEL NESOI, FOR GAS FUEL OR FOR BOTH GAS AND OTHER FUELS, NOT COOKING APPLIANCES"
732182,7321,73,"OTHER PORTABLE DOMESTIC APPLIANCES EXCEPT COOKING APPLIANCES OR PLATE WARMERS, OF IRON OR STEEL, FOR LIQUID FUEL"
732189,7321,73,FIREPLACE GRATES OF CAST IRON
732190,7321,73,"COOKING CHAMBERS, ASSEMBLED OR NOT, OF SUBHEADING 7321.11.30"
732211,7322,73,"RADIATORS FOR CENTRAL HEATING AND PARTS THEREOF, OF CAST IRON"
732219,7322,73,"RADIATORS FOR CENTRAL HEATING AND PARTS THEREOF, OF IRON OR STEEL, EXCEPT CAST IRON"
732290,7322,73,"AIR HEATERS, NOT ELECTRICALLY HEATED, INCORPORATING A MOTOR-DRIVEN FAN OR BLOWER, OF IRON OR STEEL"
732310,7323,73,"IRON OR STEEL WOOL; POT SCOURERS AND SCOURING OR POLISHING PADS, GLOVES AND THE LIKE, OF IRON OR STEEL"
732391,7323,73,"OTHER TABLE, KITCHEN OR OTHER HOUSEHOLD ARTICLES NESOI, OF CAST IRON, COATED, NOT ENAMELED, AND PARTS THEREOF"
732392,7323,73,"BAKEWARE (COOKWARE NOT SUITABLE FOR STOVE TOP USE) ARTICLES NESOI, OF CAST IRON, ENAMELED"
732393,7323,73,"TEAKETTLES OF STAINLESS STEEL, AND PARTS THEREOF"
732394,7323,73,"TEAKETTLES OF STEEL (OTHER THAN STAINLESS), ENAMELED, AND PARTS THROF"
732399,7323,73,"TABLE, KITCHEN OR OTHER HOUSEHOLD ARTICLES AND PARTS THEREOF, COATED OR PLATED WITH SILVER IRON OR STEEL (NOT CAST IRON OR STAINLESS STEEL"
732410,7324,73,SINKS OF STAINLESS STEEL WITH ONE OR MORE DRAWN BOWLS (BASINS)
732421,7324,73,"BATHS, CAST IRON, COATED OR PLATED WITH PRECIOUS METAL"
732429,7324,73,"BATHS OF IRON OR STEEL, OTHER THAN CAST IRON"
732490,7324,73,"OTHER SANITARY WARE AND PARTS, OF IRON OR STEEL (NOT BATHS, NOT SINKS OR WASH BASINS OF STAINLESS STEEL)"
732510,7325,73,"MANHOLE COVERS, RINGS AND FRAMES OF NONMALLEABLE CAST IRON"
732591,7325,73,"GRINDING BALLS AND SIM ARTICL FOR MILLS, CAST, OF IRON OR STEEL EXCEPT NONMALLEABLE CAST IRON"
732599,7325,73,OTHER CAST IRON ARTICLES NESOI
732611,7326,73,"GRINDING BALLS AND SIMILAR ARTICLES FOR MILLS, FORGED OR STAMPED, BUT NOT FURTHER WORKED, OF IRON OR STEEL"
732619,7326,73,"ARTICLES OF IRON OR STEEL, FORGED BUT NOT FURTHER WORKED, NESOI"
732620,7326,73,BELTS AND BELTING OF IRON OR STEEL WIRE
732690,7326,73,"OTHER ARTICLES OF TINPLATE, NESOI (NOT HOUSEHOLD)"
740200,7402,74,"UNREFINED COPPER, COPPER ANODES FOR ELECTROLYTIC REFINING"
740311,7403,74,REFINED COPPER CATHODES AND SECTIONS OF CATHODES
740312,7403,74,"REFINED COPPER WIRE BARS, UNWROUGHT"
740313,7403,74,"BILLETS, REFINED COPPER, UNWROUGHT"
740319,7403,74,UNWROUGHT REFINED COPPER NESOI
740321,7403,74,UNWROUGHT COPPER-ZINC BASED ALLOYS (BRASS)
740322,7403,74,UNWROUGHT COPPER-TIN BASED ALLOYS (BRONZE)
740329,7403,74,UNWROUGHT COPPER-NICKEL BASE ALLOYS (CUPRO-NICKEL) OR UNWROUGHT COPPER-NICKEL-ZINC BASE ALLOYS (NICKEL SILVER)
740500,7405,74,MASTER ALLOYS OF COPPER CONTAINING BY WEIGHT 5 PERCENT OF MORE BUT NOT MORE THAN 15 PERCENT PHOSPHORUS
740610,7406,74,COPPER POWDERS OF NON-LAMELLAR STRUCTURE
740620,7406,74,COPPER POWDERS OF LAMELLAR STRUCTURE; FLAKES
740710,7407,74,HOLLOW PROFILES OF REFINED COPPER
740721,7407,74,HOLLOW PROFILES OF COPPER-ZINC BASE ALLOYS (BRASS)
740729,7407,74,"HOLLOW PROFILES, OF COPPER-NICKEL BASE ALLOYS (CUPRO-NICKEL) OR COPPER-NICKEL-ZINC BASE ALLOYS (NICKEL SILVER)"
740811,7408,74,REFINED COPPER WIRE WITH A MAXIMUM CROSS-SECTIONAL DIMENSION OVER 9.5MM
740819,7408,74,"REFINED COPPER WIRE, WITH A MAXIMUM CROSS-SECTIONAL DIMENSION OF 3MM OR LESS"
740821,7408,74,WIRE OF COPPER-ZINC BASE ALLOYS (BRASS)
740822,7408,74,WIRE OF COPPER-NICKEL BASE ALLOYS (CUPRO-NICKEL) OR COPPER-NICKEL-ZINC BASE ALLOYS (NICKEL SILVER) COATED OR PLATED WITH METAL
740829,7408,74,"WIRE, COPPER ALLOY, (EXCEPT BRASS OR CUPRO-NICKEL OR NICKEL SILVER)  COATED OR PLATED WITH METAL"
740911,7409,74,"REFINED COPPER PLATES, SHEET AND STRIP IN COILS OF A THICKNESS OF 5MMOR MORE"
740919,7409,74,REFINED COPPER PLATES SHEET STRIP 5MM OR MORE THICK NOT COILED
740921,7409,74,"BRASS PLATE, SHEET AND STRIP, IN COILS, AT LEAST 5MM THICK"
740929,7409,74,BRASS PLATE SHEET STRIP NOT IN COILS OF A THICKNESS OF 5MM OR MORE
740931,7409,74,"BRONZE PLATES, SHEET AND STRIP, IN COILS, OF A THICKNESS OF 5MM OR M0RE"
740939,7409,74,"PHOSPHOR BRONZE PLATES, SHEET AND STRIP OF A THCKNESS OF 5MM OR MORE, NOT COILED"
740940,7409,74,"PLATES, SHEET AND STRIP OF CU-NCKL BASE ALLOYS (CUPRO-NICKEL)        OR COPPER-NICKEL-ZINC BASE ALLOYS (NICKEL SILVER)"
740990,7409,74,BERYLLIUM COPPER PLATES SHEET STRIP AT LEAST 5 MM THICK
741011,7410,74,"COPPER FOIL, NOT BACKED, OF REFINED COPPER"
741012,7410,74,FOIL OF COPPER-ZINC BASED ALLOYS (BRASS) NOT BACKED
741021,7410,74,"COPPER FOIL, BACKED, OF REFINED COPPER CLAD LAMINATES, HAVG A BASE OFWHOLLY OF PLSTCS IMPRGNTD GLASS A COPPER ON ONE SIDE ONLY"
741022,7410,74,"COPPER FOIL, BACKED, OF COPPER ALLOYS"
741110,7411,74,"TUBES AND PIPES OF REFINED COPPER, SEAMLESS, WITH OUTSIDE DIAMETER OF 6MM OR MORE, BUT NOT OVER 16MM, IN COILS ON SPOOLS"
741121,7411,74,"TUBES AND PIPES OF BRASS, SEAMLESS"
741122,7411,74,TUBES AND PIPES OF COPPER-NICKEL BASE ALLOYS (CUPRO-NICKEL) OR COPPER-NICKEL-ZINC BASE ALLOYS (NICKEL-SILVER)
741129,7411,74,"PIPES AND TUBES OF COPPER ALLOYS, NESOI, SEAMLESS"
741210,7412,74,"FITTINGS, PIPE AND TUBE OF REFINED COPPER"
741220,7412,74,"COPPER TUBE OR PIPE FITTINGS FOR BRAKEHOSES FOR VEHICLES OF 8701.21 TO 8701.29 OR 8702, 8703, 8704, 8705"
741300,7413,74,"STRANDED WIRE, OF COPPER, NOT ELECTRICALLY INSULATED, NOT FITTED WITHFITTINGS AND NOT MADE UP INTO ARTICLES"
741510,7415,74,"NAILS, TACKS, DRAWING PINS, STAPLES AND SIMILAR ARTICLES OF COPPER OR STEEL WITH HEADS OF COPPER"
741521,7415,74,COPPER WASHERS INCLUDING SPRING WASHERS NOT THREADED
741529,7415,74,"COPPER SCREWS, NUTS, BOLTS, RIVETS, AND OTHER FASTENERS NOT THREADED"
741533,7415,74,THREADED COPPER SCREWS FOR WOOD
741539,7415,74,OTHER THREADED FASTENERS NESOI OF COPPER
741810,7418,74,"POT SCOURERS AND SCOURING OR POLISHING PADS, GLOVES AND THE LIKE, BRASS"
741820,7418,74,SANITARY WARE AND PARTS THEREOF OF BRASS
741920,7419,74,BRASS PLUMBING GOODS NESOI CAST STAMPED OR FORGED BUT NOT FURTHER WORKED
741980,7419,74,"FOURDRINIER WIRE USED IN PAPERMAKING MACHINES, 94 OR MORE WIRES TO T HE LINEAR CENTIMETER, OF COPPER"
750110,7501,75,NICKEL MATTES
750120,7501,75,NICKEL OXIDE SINTERS AND OTHER INTERMEDIATE PRODUCTS OF NICKEL METALLURGY
750210,7502,75,"NICKEL, UNWROUGHT, NOT ALLOYED"
750220,7502,75,UNWROUGHT NICKEL ALLOYS
750300,7503,75,NICKEL WASTE AND SCRAP
750400,7504,75,NICKEL POWDERS
750511,7505,75,NICKEL BARS AND RODS NOT ALLOYED COLD-FORMED
750512,7505,75,COLD-FORMED BARS AND RODS OF NICKEL ALLOYS
750521,7505,75,"NICKEL WIRE, COLD FORMED, NOT ALLOYED"
750522,7505,75,"NICKEL WIRE, ALLOYED, COLD-FORMED"
750610,7506,75,"NICKEL, NOT ALLOYED, NOT EXCEEDING 0.15MM THICK"
750620,7506,75,"NICKEL ALLOY, NOT EXCEEDING 0.15MM THICK"
750711,7507,75,"PIPES AND TUBES OF NICKEL, NOT ALLOYED"
750712,7507,75,PIPES AND TUBES OF NICKEL ALLOYS
750720,7507,75,TUBE OR PIPE FITTINGS OF NICKEL
750810,7508,75,"CLOTH, GRILL AND NETTING OF NICKEL WIRE"
750890,7508,75,STRANDED WIRE OF NICKEL
760110,7601,76,UNW ALUM NT ALOYD OF UNIFM CROS SECT THROUT IT LNTH LEST CROS SECT DIMNSON NT GREATER THAN 9.5 MM IN COILS
760120,7601,76,"UNWROUGHT ALUM ALLOY OF UNIFM CROS SECT THROUT IT LNTH LEST CROS SECT DIM NT GREATER THAN 9.5MM, COILS"
760200,7602,76,RECYCLABLE USED BEVERAGE CONTAINERS
760310,7603,76,ALUMINUM POWDERS OF NON-LAMELLAR STRUCTURE
760320,7603,76,"ALUMINUM POWDERS OF LAMELLAR STRUCTURE, FLAKES"
760410,7604,76,ALUMINUM PROFILES NOT ALLOYED
760421,7604,76,"ALUMINUM ALLOY HOLLOW PROFILES, HEAT-TREATABLE INDUSTRIAL ALLOYS OF A KIND DESCRIBED IN STATISTICAL NOTE 6 TO THIS CHAPTER"
760429,7604,76,"ALUMINUM ALLOY PROFILES, HEAT-TREATABLE INDUSTRIAL ALLOYS OF A KIND DESCRIBED IN STATISTICAL NOTE 3 TO THIS CHAPTER, NOT HOLLOW"
760511,7605,76,ALUMINUM WIRE NOT ALLOYED OF WHICH THE MAXIMUM CROSS-SECTIONAL DIMENSION EXCEEDS 7 MM
760519,7605,76,ALUMINUM WIRE NOT ALLOYED OF WHICH THE MAXIMUM CROSS-SECTIONAL DIMENSION IS 7MM OR LESS
760521,7605,76,ALUMINUM WIRE ALLOY OF WHICH THE MAXIMUM CROSS-SECTIONAL DIMENSION EXCEEDS 7MM
760529,7605,76,ALUMINUM WIRE ALLOY OF WHICH THE MAXIMUM CROSS-SECTIONAL DIMENSION IS 7MM OR LESS
760611,7606,76,ALUMINUM PLATES SHEETS AND STRIP RECTANGULAR INCLUDING SQUARE NOT ALLOYED NOT CLAD WITH THICKNESS OF MORE THAN 6.3MM
760612,7606,76,"ALUMINUM PLATES SHEETS & STRIP RECTANGULAR (INC SQUARE) NOT CLAD,THICKNESS MORE THAN 6.3MM, HIGH-STRENGTH HEAT-TREATABLE ALLOY, STAT NOTE 5, CH 76"
760691,7606,76,"ALUMINUM PLATE SHEETS AND STRIP, OTHER THAN RECTANGULAR, WITH A THICKNESS OF MORE THAN 6.3 MM, NOT ALLOYED, NOT CLAD"
760692,7606,76,"ALUMINUM ALLOYS, NOT CLAD WITH A THICKNESS OF MORE THAN 6.3MM"
760711,7607,76,"ALUMINUM FOIL OF A THICKNESS NOT EXCEEDING 0.01MM NOT BACKED, ROLLED BUT NOT FURTHER WORKED"
760719,7607,76,"ALUMINUM FOIL OF A THICKNESS NOT EXCEEDING 0.2MM NOT BACKED, ETCHED CAPACITOR FOIL"
760720,7607,76,"ALUMINUM FOIL OF A THICKNESS NOT EXCEEDING 0.2MM BACKED, COVERED OR DECORATED WITH A CHARACTER, DESIGN, FANCY EFFECT OR PATTERN"
760810,7608,76,"ALUMINUM TUBES AND PIPES NOT ALLOY, SEAMLESS"
760820,7608,76,"TUBES AND PIPES, ALUMINUM ALLOY, SEAMLESS"
760900,7609,76,"ALUMINUM TUBE OR PIPE FITTINGS (COUPLINGS,ELBOWS SLEEVES)"
761010,7610,76,ALUMINUM WINDOWS AND THEIR FRAMES
761090,7610,76,"ALUMINUM SHEET-METAL ROOFING, SIDING, FLOORING, AND ROOF GUTTERING AND DRAINAGE EQUIPMENT"
761100,7611,76,ALUMINUM TANKS WITH CAPACITY EXCEEDING 300 LITERS
761210,7612,76,ALUMINUM COLLAPSIBLE TUBULAR CONTAINERS CAP NT OV 300 LITERS
761290,7612,76,"OTHER ALUMINUM CANS NOT EXCEEDING 355ML CAPACITY, WITH A CIRCULAR CROSS SECTION, OF A KIND USED FOR AEROSOLS"
761300,7613,76,ALUMINUM CONTAINERS FOR COMPRESSED OR LIQUEFID GAS
761410,7614,76,"STRANDED WIRE, CABLES, PLAITED BANDS A SMLR, WITH STEEL CORE NOT FITTED WITH FITTINGS AND NOT MADE UP INTO ARTICLES"
761490,7614,76,"ELECTRICAL CONDUCTORS OF ALUMINUM STRANDED WIRE WITH A CROSS-SECTIONAL AREA LESS THAN 240 MM2, NOT FITTED"
761510,7615,76,"POT SCOURERS, SCOURING OR POLISHING PADS, GLOVES, ETC OF ALUMINUM"
761520,7615,76,ALUMINUM SANITARY WARE AND PARTS THEREOF
761610,7616,76,"ALUMINUM NAILS, TACKS A STAPLES NOT IN 8305"
761691,7616,76,"CLOTH, GRILL, NETTING AND FENCING OF ALUMINUM WIRE"
761699,7616,76,ALUMINUM LUGGAGE FRAMES
780110,7801,78,"REFINED LEAD, UNWROUGHT"
780191,7801,78,LEAD UNWROUGHT CONTAINING BY WEIGHT ANTIMONY AS THE PRINCIPAL OTHER ELEMENT
780199,7801,78,"LEAD BULLION, UNWROUGHT"
780200,7802,78,LEAD WASTE AND SCRAP OBTAINED FROM LEAD-ACID STORAGE BATTERIES
780411,7804,78,"LEAD SHEETS, STRIP AND FOIL OF A THICKNESS (EXCL BCKG) NOT EXCEEDING 0.2 MM"
780419,7804,78,"LEAD PLATES, SHEET, STRIP AND FOIL EXCEEDING 0.2 MM IN THICKNESS"
780420,7804,78,LEAD POWDERS AND FLAKES
780600,7806,78,LEAD BARS RODS PROFILES AND WIRE
790111,7901,79,"ZINC, UNWROUGHT, NOT ALLOYED, CONTAINING BY WEIGHT 99.99 PERCENT OR MORE OF ZINC"
790112,7901,79,"ZINC, UNWRGHT, NT ALLOYD, CNTG UN 99.99 PC ZNC CSTG GRD"
790120,7901,79,"ZINC ALLOYS, UNWROUGHT"
790200,7902,79,ZINC WASTE AND SCRAP
790310,7903,79,ZINC DUST
790390,7903,79,ZINC POWDERS
790400,7904,79,"ZINC BARS, RODS, PROFILES AND WIRE"
790500,7905,79,"ZINC PLATES, SHEET, STRIP AND FOIL"
790700,7907,79,"ZINC ARTICLES USED FOR HOUSEHOLD, TABLE OR KITCHEN; TOILET AND SANITARY WARES OF ZINC"
800110,8001,80,"TIN, UNWROUGHT, NOT ALLOYED"
800120,8001,80,TIN ALLOYS UNWROUGHT CONTAINING BY WEIGHT 5 PERCENT OR LESS LEAD
800200,8002,80,TIN WASTE AND SCRAP
800300,8003,80,"TIN BARS, RODS, PROFILES AND WIRE"
800700,8007,80,TIN ARTICLES NESOI SUITABLE FOR FOOD OR BEVERAGE SERVICE NOT PRECIOUSMETAL PLATED
810110,8101,81,TUNGSTEN (WOLFRAM) POWDERS
810194,8101,81,"UNWROUGHT TUNGSTEN, INCLUDING BARS AND RODS OBTAINED SIMPLY BY SINTERING"
810196,8101,81,TUNGSTEN WIRE
810197,8101,81,TUNGSTEN WASTE AND SCRAP
810199,8101,81,"TUNGSTEN ( WOLFRAM ) BARS AND RODS, OTHER THAN THOSE OBTAINED SIMPLY BY SINTERING, PROFILES, PLATES, SHEETS, STRIP AND FOIL"
810210,8102,81,MOLYBDENUM POWDERS
810294,8102,81,"UNWROUGHT MOLYBDENUM, INCLUDING BARS AND RODS OBTAINED SIMPLY BY SINTERING"
810295,8102,81,"MOLYBDENUM BARS AND RODS, OTHER THAN THOSE OBTAINED SIMPLY BY SINTERING"
810296,8102,81,MOLYBDENUM WIRE
810297,8102,81,MOLYBDENUM WASTE AND SCRAP
810299,8102,81,"MOLYBDENUM, WROUGHT"
810320,8103,81,TANTALUM POWDERS
810330,8103,81,TANTALUM WASTE AND SCRAP
810391,8103,81,CRUCIBLES OF TANTALUM
810399,8103,81,"ARTICLES OF TANTALUM, NESOI"
810411,8104,81,"UNWROUGHT MAGNESIUM, CONTAINING AT LEAST 99.8 PERCENT BY WEIGHT OF MAGNESIUM"
810419,8104,81,"MAGNESIUM, OTHER, NESOI, UNWROUGHT"
810420,8104,81,MAGNESIUM WASTE AND SCRAP
810430,8104,81,"MAGNESIUM RASPINGS, TURNINGS AND GRANULES, GRADED ACCORDING TO SIZE; POWDERS"
810490,8104,81,"MAGNESIUM, WROUGHT"
810520,8105,81,UNWROUGHT COBALT ALLOYS
810530,8105,81,COBALT WASTE AND SCRAP
810590,8105,81,"COBALT, WROUGHT, AND ARTICLES THEREOF"
810610,8106,81,"BISMUTH AND ARTICLES THEREOF CONTAINING MORE THAN 99.99% BISMUTH, BY WEIGHT"
810690,8106,81,"BISMUTH AND ARTICLES THEREOF, INCLUDING WASTE AND SCRAP, NESOI"
810820,8108,81,"SPONGE, TITANIUM"
810830,8108,81,TITANIUM WASTE AND SCRAP
810890,8108,81,TITANIUM CASTINGS
810921,8109,81,UNWROUGHT ZIRCONIUM POWDERS CONTAINING LESS THAN 1 PART HAFNIUM TO 500 PARTS ZIRCONIUM BY WEIGHT
810929,8109,81,"UNWROUGHT ZIRCONIUM POWDERS, NESOI"
810931,8109,81,ZIRCONIUM WASTE AND SCRAP CONTAINING LESS THAN 1 PART HAFNIUM TO 500 PARTS ZIRCONIUM BY WEIGHT
810939,8109,81,"ZIRCONIUM WASTE AND SCRAP, NESOI"
810991,8109,81,"ZIRCONIUM AND ARTICLES THEREOF CONTAINING LESS THAN 1 PART HAFNIUM TO 500 PARTS ZIRCONIUM BY WEIGHT, NESOI"
810999,8109,81,"ZIRCONIUM AND ARTICLES THEREOF, NESOI"
811010,8110,81,UNWROUGHT ANTIMONY; POWDERS
811020,8110,81,ANTIMONY WASTE AND SCRAP
811090,8110,81,"ANTIMONY AND ARTICLES THEREOF, NESOI"
811100,8111,81,MANGANESE WASTE AND SCRAP
811212,8112,81,OTHER UNWROUGHT BERYLLIUM; BERYLLIUM POWDERS
811213,8112,81,BERYLLIUM WASTE AND SCRAP
811219,8112,81,"OTHER BERYLLIUM, WROUGHT, AND ARTICLES, THEREOF NESOI"
811221,8112,81,UNWROUGHT CHROMIUM; POWDERS
811222,8112,81,CHROMIUM WASTE AND SCRAP
811229,8112,81,"CHROMIUM AND ARTICLES THEREOF, NESOI"
811231,8112,81,UNWROUGHT HAFNIUM INCL POWDERS
811239,8112,81,"HAFNIUM AND ARTICLES THEREOF, NESOI"
811241,8112,81,RHENIUM WASTE AND SCRAP
811249,8112,81,"RHENIUM AND ARTICLES THEREOF, NESOI"
811251,8112,81,UNWROUGHT THALLIUM; POWDERS
811252,8112,81,THALLIUM WASTE AND SCRAP
811259,8112,81,"THALLIUM AND ARTICLES THEREOF, NESOI"
811261,8112,81,UNWROUGHT CADMIUM; WASTE AND SCRAP
811269,8112,81,UNWROUGHT CADMIUM; POWDERS
811292,8112,81,"BASE METALS, WASTE AND SCRAP, NESOI"
811299,8112,81,"GERMANIUM AND ARTICLES THEREOF, WROUGHT, WASTE AND SCRAP, POWDERS, NESOI"
811300,8113,81,"CERMETS AND ARTICLES THEREOF, INCLUDING WASTE AND SCRAP"
820110,8201,82,SPADES AND SHOVELS AND PARTS THEREOF OF BASE METAL
820130,8201,82,"MATTOCKS AND PICKS, AND PARTS THEREOF, OF BASE METAL"
820140,8201,82,MACHETES AND PARTS THEREOF OF BASE METAL
820150,8201,82,"ONE-HANDED SECATEURS AND SIMILAR ONE-HANDED PRUNERS AND SHEARS (INCLUDING POULTRY SHEARS), AND PARTS THEREOF"
820160,8201,82,"HEDGE SHEARS, TWO-HANDED PRUNING SHEARS AND SIMILAR TWO-HANDED SHEARS AND PARTS THEREOF"
820190,8201,82,"GRASS SHEARS AND PARTS THEREOF, BASE METAL"
820210,8202,82,"HANDSAWS AND PARTS EXCEPT BLADES, BASE METAL"
820220,8202,82,METAL CUTTING BANDSAW BLADES OF BASE METAL
820231,8202,82,CIRCULR SAW BLADES OF BASE METAL WITH WORKING PART OF STEEL
820239,8202,82,"SAWBLADES WITH DIAMOND WORKING PARTS, OF BASE METAL, AND PARTS THEREOF"
820240,8202,82,"CHAIN SAW BLDS AND PARTS, WITH CUTTING PARTS OVER 0.2 PERCENT CHROMIUM, MOLYBDENUM OR TUNGSTEN OR OVER 0.1 PERCENT VANADIUM"
820291,8202,82,HACKSAW BLADES OF BASE METAL
820299,8202,82,"OTHER SAW BLADES AND PARTS, BASE METAL"
820310,8203,82,"FILES,RASPS AND SIMILAR TOOLS NOT OVER 11CM LONG BASE METAL"
820320,8203,82,TWEEZERS BASE METAL
820330,8203,82,"METAL CUTTING SHEARS AND SIMILAR TOOLS, AND PARTS"
820340,8203,82,"PIPE OR BOLT CUTTERS, PERFORATING PUNCHES, AND SIMILAR TOOLS WITH C  UTTING PART OVER 0.2 PCT CHROMIUM,MOLYBDM OR TUNGST OR OVR 0.1 PCT V ANADIUM"
820411,8204,82,"OPEN-END, BOX AND COMBINATION OPEN-END AND BOX WRENCHES, BASE METAL"
820412,8204,82,"HAND-OPERATED SPANNERS AND WRENCHES, ADJUSTABLE, AND PARTS, BASE METAL"
820420,8204,82,"SOCKET WRENCHES WITH OR WITHOUT HANDLES, DRIVES AND EXTENSIONS, PARTS, BASE METAL"
820510,8205,82,"DRILLING, THREADING OR TAPPING TOOLS AND PARTS THEREOF, BASE METAL"
820520,8205,82,"HAMMERS AND SLEDGE HAMMERS, HEADS NOT OVER 1.5KG EACH OF BASE METAL"
820530,8205,82,"PLANES, CHISELS, GOUGES AND SIMILAR WOODWORKING TOOLS, CUTTING PART OVER 0.2 PCT CHROMIUM,MOLYBDENUM OR TUNGSTEN OV 1.0 PCT VANADIUM"
820540,8205,82,"SCREWDRIVERS,AND PARTS THEREOF, BASE METAL"
820551,8205,82,"CARVING AND BUTCHER STEELS, WITH OR WITHOUT HANDLES, OF IRON O STEEL"
820559,8205,82,"PIPE TOOLS AND PARTS THEREOF, BASE METAL"
820560,8205,82,"BLOW TORCHES AND SIMILAR SELF-CONTAINED TORCHES, PARTS"
820570,8205,82,PIPE VISES
820590,8205,82,"ANVILS; PORTABLE FORGES, HAND- OR PEDAL-OPERATED GRINDING WHEELS WITH FRAMEWORKS; BASE METAL PARTS THEREOF"
820600,8206,82,"TOOLS OF 2 OR MORE OF HEADINGS 8202 TO 8205, IN SETS FOR RETAIL SALE"
820713,8207,82,"ROCK DRILLING OR EARTH BORING TOOLS WITH WORKING PART OF CERMETS, AND PARTS THEREOF"
820719,8207,82,"PERCUSSION ROCK DRILL BITS WITH CUTTING PART OVER 0.2 PERCENT CHROMIUM, MOLYBDENUM OR TUNGSTEN OR OVER 0.1 PERCENT VANADIUM, AND PARTS THEREOF"
820720,8207,82,DIAMOND WIRE DIES FOR DRAWING AND EXTRUDING METAL
820730,8207,82,"TOOLS FOR PRESSING, STAMPING OR PUNCHING, SUITABLE FOR CUTTING METAL"
820740,8207,82,"TOOLS F TAPPING OR THREADING A PTS W CUTTG PT CNTG OV 0.2 PC CHROM, MOLY OR TNGSTN OR OVR 0.1 PC VANADIUM"
820750,8207,82,"MASONRY DRILLS, NOT FOR ROCK DRILLING, WITH CUTTING PARTS OVER 0.2 PCT CHROMIUM, MOLYBDENUM, TUNGSTEN, OR OVER 0.1 PCT VANADIUM BY WEIGHT"
820760,8207,82,BROACHES
820770,8207,82,END MILLING CUTTERS W CUTTING PART CONTAINING SPEC METALS
820780,8207,82,TURNING TOOLS WITH CUTTING PART CONTAINING BY WEIGHT OVR 0.2 PC CHROM MOLY OR TUNGSTN OR OVR 0.1 PC VANADIUM
820790,8207,82,"FILES AND RASPS INCLUDING ROTARY, INTERCHANGEABLE, AND PARTS"
820810,8208,82,KNIVES AND CUTTING BLADES FOR METAL SHEARING MACHINES OVER 30.5 5CM LONG OR OVER 15.2CM DIAMETER FOR METAL SHEARING/SPLITTING MACHS
820820,8208,82,"KNIVES AND CUTTING BLADES OVER 73.7 CM IN LENGTH, FOR VENEER CUTTING MACHINES"
820830,8208,82,"KNIVES AND CUTTING BLADES FOR MEAT-SLICING, -CUTTING OR -CHOPPING, MACHINES AND APPLIANCES"
820840,8208,82,LAWNMOWER BLADES
820890,8208,82,KNIVES AND CUTTING BLADES FOR SHOE MACHINERY
820900,8209,82,"PLATES, STICKS, TIPS AND THE LIKE FOR TOOLS, UNMOUNTED, OF SINTERED METAL CARBIDES"
821000,8210,82,"HAND-OPERATED MECHANICAL APPLIANCES 10KG OR LESS FOR PREPARATION, CONDITIONING OR SERVING OF FOOD OR DRINK, AND BASE METAL PARTS THEREOF"
821110,8211,82,SETS OF ASSORTED KNIVES AND BLADES AND BASE METAL PARTS THEREOF EXCEPT KNIVES OF 8208
821191,8211,82,TABLE KNIVES FIXED BLADE SILVER-PLATED HANDLES
821192,8211,82,"KITCHEN AND BUTCHER KNIVES, FIXED BLADE, RUBBER OR PLASTIC HANDLES"
821193,8211,82,POCKET KNIVES FOLDING TWO-HANDLED MULTI-USE TOOLS IN WHICH ONE OR MORE TOOLS ARE HOUSED IN EACH HANDLE AND ONE OR MORE OF THE TOOLS IS A FOLDING BLADE
821194,8211,82,BLADES FOR KNIVES HAVING FIXED BLADES
821195,8211,82,HANDLES OF BASE METAL FOR TABLE KNIVES WITH FIXED BLADES
821210,8212,82,RAZORS
821220,8212,82,SINGLE EDGE RAZOR BLADES FOR SHAVING
821290,8212,82,PARTS FOR RAZORS EXC BLADES
821300,8213,82,"SCISSORS, TAILORS SHEARS AND SIMILAR SHEARS, BLADES AND OTHER BASE METAL PARTS THEREOF NOT OVER $1.75/DOZEN"
821410,8214,82,"PAPER KNIVES, LETTER OPENERS, ERASING KNIVES, PENCIL SHARPENERS (NONMECHANICAL), BLADES AND OTHER BM PARTS THEREOF"
821420,8214,82,"MANICURE OR PEDICURE INSTRUMENTS AND BASE METAL PARTS THEREOF, NOT INSETS"
821490,8214,82,"CLEAVERS WITH THEIR HANDLES, NESOI"
821510,8215,82,"SETS OF ASSORTED TABLEWARE, AT LEAST ONE ARTICLE PLATED WITH PRECIOUS METAL, BASE METAL PARTS"
821520,8215,82,"SETS OF ASSORTED TABLEWARE, NOT PRECIOUS METAL PLATED, INCLUDING BASE METAL PARTS"
821591,8215,82,"TABLE AND KTCHN FORKS PREC MTL PLT,AND PARTS"
821599,8215,82,"FORKS, STAINLESS STEEL HANDLES CONTAINING NICKEL OR OVER 10 PERCENT MANGANESE, UNDER 25 CENTS EACH NOT OVER 25.9CM LONG"
830110,8301,83,"PADLOCKS, NOT OF CYLINDER OR PIN TUMBLER CONSTRUCTION, OF BASE METAL, NOT OVER 3.8 CM IN WIDTH"
830120,8301,83,"NON-INTEGRAL STEERING WHEEL IMMOBILIZER DEVICES, OF BASE METAL"
830130,8301,83,"CAM LOCKS AND OTHER BASE METAL LOCKS SUITABLE FOR USE WITH CHESTS, DRAWERS AND SIMILAR ITEMS"
830140,8301,83,"LUGGAGE LOCKS, BASE METAL"
830150,8301,83,"CLASPS AND FRAMES WITH CLASPS, INCORPORATING LOCKS, OF BASE METAL"
830160,8301,83,"PARTS OF LOCKS, BASE METAL"
830170,8301,83,KEYS PRESENTED SEPARATELY
830210,8302,83,"HINGES AND PARTS THEREOF, OF IRON OR STEEL, ALUMINUM OR ZINC, DESIGNED FOR MOTOR VEHICLES"
830220,8302,83,"CASTORS, AND PARTS THEREOF, OF BASE METAL"
830230,8302,83,"PNEUMATIC CYLINDERS FOR LIFTING, LOWERING, DAMPENING OR COUNTERBALANCING, SUITABLE FOR MOTOR VEH, OF IRON OR STEEL, ALUMINUM OR ZINC AND PARTS THEREOF"
830241,8302,83,"DOOR CLOSERS (EXCEPT AUTOMATIC DOOR CLOSERS) AND PARTS THEREOF, OF BASE METAL, SUITABLE FOR BUILDINGS"
830242,8302,83,"PNEUMATIC CYLINDERS FOR LIFTING, LOWERING, DAMPENING OR COUNTERBALANCING, SUITABLE FOR FURNITURE, OF IRON OR STEEL, ALUMINUM, OR ZINC, AND PARTS THERF"
830249,8302,83,"HARNESS AND SADDLERY OR RIDING-BRIDLE HARDWARE AND PARTS THEREOF, OF BASE METAL COATED OR PLATED WITH PRECIOUS METAL"
830250,8302,83,"HAT-RACKS, HAT PEGS, BRACKETS AND SIMILAR FIXTURES, AND PARTS THEREOF, OF BASE METAL"
830260,8302,83,AUTOMATIC DOOR CLOSERS OF BASE METAL
830300,8303,83,"ARMORED OR REINFORCED SAFES, STRONG-BOXES AND DOORS AND SAFE DEPOSIT LOCKERS FOR STRONG-ROOMS, CASH OR DEED BOXES ETC AND PARTS, OF BASE METAL"
830400,8304,83,"DESK-TOP FILING OR CARD-INDEX CABINETS, PAPER TRAYS, PAPER RESTS, PEN TRAYS, OFFICE-STAMP STANDS ETC AND PTS THEREOF, BS MTL, EXC OFC FURNIN HDNG 9403"
830510,8305,83,"RING BINDER MECHANISMS FOR LOOSELEAF BINDERS, BASE METAL"
830520,8305,83,"STAPLES IN STRIPS, OF BASE METAL"
830590,8305,83,"PAPER CLIPS AND PARTS THEREOF, WHOLLY OF WIRE, BASE METAL"
830610,8306,83,"BELLS, GONGS AND THE LIKE, AND PARTS THEREOF, BASE METAL"
830621,8306,83,"STATUETTES AND OTHER ORNAMENTS, AND PARTS THEREOF, OF BASE METAL PLATED WITH PRECIOUS METAL"
830629,8306,83,"STAUETTES AND OTHER ORNAMENTS, AND PARTS THEREOF, OF BASE METAL NOT PLATED WITH PRECIOUS METAL"
830630,8306,83,"PHOTOGRAPH, PICTURE OR SIMILAR FRAMES; MIRRORS; PARTS THEREOF, OF BASE METAL"
830710,8307,83,"FLEXIBLE TUBING OF IRON OR STEEL, WITH FITTINGS"
830790,8307,83,"FLEXIBLE TUBING OF BASE METAL OTHER THAN IRON OR STEEL, WITH FITTINGS"
830810,8308,83,"HOOKS, EYES AND EYELETS, OF BASE METAL"
830820,8308,83,"TUBULAR OR BIFURCATED RIVETS OF IRON OR STEEL AND NOT BRIGHTENED, NOT LATHED AND NOT MACHINED"
830890,8308,83,BEADS AND SPANGLES OF BASE METAL
830910,8309,83,"CROWN CORKS (INCLUDING CROWN SEALS AND CAPS), AND PARTS THEREOF, OF BASE METAL"
830990,8309,83,"ALUM STOPPERS, CAPS, LIDS FOR CCANS OF A KIND USED FOR THE CONVEYANCE OF BEVERAGES AS DESCRIBED IN ST NOTE 1 TO THIS CHAPTER"
831000,8310,83,"SIGN PLATES, NAME PLATES, ADDRESS PLATES AND SIMILAR PLATES, NUMBERS, LETTERS AND OTHER SYMBOLS, AND PARTS THEREOF, OF BASE METAL, EXCEPT OF HDNG 9405"
831110,8311,83,"COATED ELECTRODES OF BASE METAL, FOR ELECTRIC ARC-WELDING"
831120,8311,83,"CORED WIRE OF BASE METAL, FOR ELECTRIC ARC-WELDING"
831130,8311,83,LEAD-TIN SOLDERS (COATED RODS AND CORED WIRE)
831190,8311,83,"WIRE, RODS, TUBES, PLATES, ELECTRODES ETC, BASE METAL OR METAL CARBIDES, CTD/CRD W FLUX MATERL, FOR SOLDERING ETC, WR A RDS OF AGGLOM BM PDR PTS NESOI"
840110,8401,84,NUCLEAR REACTORS
840120,8401,84,ISOTOPIC SEPARATION MACHINERY AND APPARATUS AND PARTS THEREOF
840130,8401,84,"FUEL ELEMENTS (CARTRIDGES), NON-IRRADIATED FOR NUCLEAR REACTORS, AND PARTS THEREOF"
840140,8401,84,PARTS OF NUCLEAR REACTORS
840211,8402,84,WATERTUBE BOILERS WITH A STEAM PRODUCTION EXCEEDING 45 T PER HOUR
840212,8402,84,WATERTUBE BOILERS WITH A STEAM PRODUCTION NOT EXCEEDING 45 T PER HOUR
840219,8402,84,"VAPOR GENERATING BOILERS, NESOI, INCLUDING HYBRID BOILERS"
840220,8402,84,SUPER-HEATED WATER BOILERS
840290,8402,84,HEAT EXCHANGERS
840310,8403,84,CENTRAL HEATING BOILERS
840390,8403,84,PARTS FOR CENTRAL HEATING BOILERS
840410,8404,84,ECONOMIZERS FOR USE WITH BOILERS OF HEADING 8402 OR 8403
840420,8404,84,CONDENSERS FOR STEAM OR OTHER VAPOR POWER UNITS
840490,8404,84,PARTS FOR AUXILIARY PLANT FOR USE WITH BOILERS OF HEADING 8402 OR 8403 AND CONDENSERS FOR STEAM OR OTHER VAPOR POWER UNITS
840510,8405,84,"PRODUCER GAS, WATER GAS, ACETYLENE GAS AND SIMILAR WATER PROCESS GAS GENERATORS, WITH OR WITHOUT THEIR PURIFIERS"
840590,8405,84,"PARTS FOR PRODUCER GAS, WATER GAS, ACETYLENE GAS AND SIMILAR WATER PROCESS GAS GENERATORS, WITH OR WITHOUT THEIR PURIFIERS"
840610,8406,84,STEAM TURBINES FOR MARINE PROPULSION
840681,8406,84,"STEAM TURBINES, EXCEPT MARINE PROPULSION, STATIONARY, CONDENSING TYPE, GT 40MW"
840682,8406,84,"STEAM TURBINES, EXCEPT MARINE PROPULSION, STATIONARY, CONDENSING TYPE, NOT EXCEEDING 7,460 KW"
840690,8406,84,"ROTORS, FINISHED FOR FINAL ASSEMBLY , PARTS OF STEAM TURBINES"
840710,8407,84,"SPARK-IGNITION RECIPROCATING OR ROTARY INTERNAL COMBUSTION PISTON ENGINES FOR CIVIL AIRCRAFT, NEW, LESS THAN 373 KW"
