HS6,HS4,HS2,Description
010121,0101,01,"HORSES, LIVE, PUREBRED BREEDING MALE"
010129,0101,01,"HORSES, LIVE, IMPORTED FOR IMMEDIATE SLAUGHTER"
010130,0101,01,"ASSES, LIVE"
010190,0101,01,"MULES AND HINNIES, IMPORTED FOR IMMEDIATE SLAUGHTER, LIVE"
010221,0102,01,"CATTLE, LIVE, PUREBRED BREEDING MALE, DAIRY"
010229,0102,01,"CATTLE, IMPORTED SPECIALLY FOR DAIRY PURPOSES, WEIGHING LESS THAN 90 KG EACH, LIVE, EXCEPT PUREBRED BREEDING"
010231,0102,01,"BUFFALO, LIVE, PUREBRED BREEDING, MALE, EXCEPT DAIRY"
010239,0102,01,"BISON, LIVE"
010290,0102,01,"BOVINES, LIVE, OTHER THAN CATTLE OR BUFFALO"
010310,0103,01,"SWINE, PUREBRED BREEDING, LIVE"
010391,0103,01,"SWINE, WEIGHING LESS THAN 7 KG EACH, LIVE, EXCEPT PUREBRED BREEDING"
010392,0103,01,"SWINE, LIVE, IMPORTED FOR IMMEDIATE SLAUGHTER, WEIGHING 50 KG OR MORE EACH, EXCEPT PUREBRED BREEDING"
010410,0104,01,"SHEEP, LIVE"
010420,0104,01,"GOATS, LIVE"
010511,0105,01,"CHICKENS, LIVE, WEIGHING NOT MORE THAN 185 G EACH, BREEDING STOCK, LAYER-TYPE (EGG-TYPE)"
010512,0105,01,"TURKEYS, LIVE, WEIGHING NOT MORE THAN 185 G EACH"
010513,0105,01,"DUCKS, LIVE, WEIGHING NOT MORE THAN 185 G EACH"
010514,0105,01,"GEESE, LIVE, WEIGHING NOT MORE THAN 185 G EACH"
010515,0105,01,"GUINEA FOWLS, LIVE, WEIGHING NOT MORE THAN 185 G EACH"
010594,0105,01,"CHICKENS, LIVE, WEIGHING 185 G OR MORE EACH"
010599,0105,01,"POULTRY, LIVE, WEIGHING 185 G OR MORE EACH, NESOI"
010611,0106,01,"PRIMATES, LIVE"
010612,0106,01,"WHALES, DOLPHINS AND PORPOISES; MANATEES AND DUGONGS; SEALS, SEA LIONS AND WALRUSES, LIVE"
010613,0106,01,"CAMELS AND OTHER CAMELIDS (CAMELIDAE), LIVE"
010614,0106,01,"RABBITS AND HARES, LIVE"
010619,0106,01,"FOXES, LIVE"
010620,0106,01,"REPTILES (INCLUDING SNAKES AND TURTLES), LIVE"
010631,0106,01,"BIRDS OF PREY, LIVE"
010632,0106,01,"PSITTACIFORMES (INCLUDING PARROTS, PARAKEETS, MACAWS AND COCKATOOS), LIVE"
010633,0106,01,"OSTRICHES; EMUS (DROMAIUS NOVAEHOLLANDIAE), LIVE"
010639,0106,01,"BIRDS, LIVE, NESOI"
010641,0106,01,"BEES, LIVE"
010649,0106,01,"LARVAE OF LEAF CUTTER BEE, LIVE"
010690,0106,01,"WORMS, LIVE"
020110,0201,02,"CARCASSES AND HALF-CARCASSES OF VEAL, FRESH OR CHILLED, AS SPECIFIED IN GENERAL NOTE 15"
020120,0201,02,"BEEF WITH BONE IN, HIGH-QUALITY CUTS, PROCESSED, FRESH OR CHILLED, AS SPECIFIED IN GENERAL NOTE 15"
020130,0201,02,"BEEF, BONELESS, HIGH-QUALITY CUTS, PROCESSED, FRESH OR CHILLED, AS SPECIFIED IN GENERAL NOTE 15"
020210,0202,02,"CARCASSES AND HALF-CARCASSES OF VEAL, FROZEN, AS SPECIFIED IN GENERAL NOTE 15"
020220,0202,02,"BEEF WITH BONE IN, HIGH QUALITY CUTS, PROCESSED, FROZEN, AS SPECIFIED IN GENERAL NOTE 15"
020230,0202,02,"BEEF, BONELESS, HIGH QUALITY CUTS, PROCESSED, FROZEN, AS SPECIFIED IN GENERAL NOTE 15"
020311,0203,02,"CARCASSES AND HALF-CARCASSES OF SWINE, FRESH OR CHILLED"
020312,0203,02,"HAMS AND CUTS THEREOF, OF SWINE, WITH BONE IN, PROCESSED, FRESH OR CHILLED"
020319,0203,02,"SPARE RIBS OF SWINE, PROCESSED, FRESH OR CHILLED"
020321,0203,02,"CARCASSES AND HALF-CARCASSES OF SWINE, FROZEN"
020322,0203,02,"HAMS, SHOULDERS AND CUTS THEREOF, OF SWINE, WITH BONE IN, PROCESSED, FROZEN"
020329,0203,02,"MEAT OF SWINE, PROCESSED, FROZEN, NESOI"
020410,0204,02,"CARCASSES AND HALF-CARCASSES OF LAMB, FRESH OR CHILLED"
020421,0204,02,"CARCASSES AND HALF-CARCASSES OF SHEEP, FRESH OR CHILLED"
020422,0204,02,"SHOULDERS OF LAMB, WITH BONE IN, FRESH OR CHILLED"
020423,0204,02,"MEAT OF LAMB, BONELESS, FRESH OR CHILLED"
020430,0204,02,"CARCASSES AND HALF-CARCASSES OF LAMB, FROZEN"
020441,0204,02,"CARCASSES AND HALF-CARCASSES OF SHEEP, FROZEN"
020442,0204,02,"SHOULDERS OF LAMB, WITH BONE IN, FROZEN"
020443,0204,02,"MEAT OF LAMB, BONELESS, FROZEN"
020450,0204,02,"MEAT OF GOATS, FRESH, CHILLED OR FROZEN"
020500,0205,02,"MEAT OF HORSES, ASSES, MULES OR HINNIES, FRESH, CHILLED OR FROZEN"
020610,0206,02,"OFFAL OF BOVINES, EDIBLE, FRESH OR CHILLED"
020621,0206,02,"TONGUES OF BOVINES, EDIBLE, FROZEN"
020622,0206,02,"LIVERS OF BOVINES, EDIBLE, FROZEN"
020630,0206,02,"OFFAL OF SWINE, EDIBLE, FRESH OR CHILLED"
020641,0206,02,"LIVERS OF SWINE, EDIBLE, FROZEN"
020680,0206,02,"OFFAL OF SHEEP, GOATS, HORSES, ASSES, MULES OR HINNIES, EDIBLE, FRESH OR CHILLED"
020690,0206,02,"OFFAL OF SHEEP (INCLUDING LAMB), EDIBLE, FROZEN"
020711,0207,02,"CHICKENS, WHOLE, YOUNG (BROILERS, FRYERS, ROASTERS AND CAPONS), FRESH OR CHILLED"
020712,0207,02,"CHICKENS, WHOLE, YOUNG (BROILERS, FRYERS, ROASTERS AND CAPONS), FROZEN"
020713,0207,02,"MEAT AND EDIBLE OFFAL OF CHICKENS, FRESH OR CHILLED"
020714,0207,02,"LIVERS OF CHICKENS, FROZEN"
020724,0207,02,"TURKEYS, WHOLE, FRESH OR CHILLED"
020725,0207,02,"TURKEYS, WHOLE, VALUED AT LESS THAN $0.88 PER KG, FROZEN"
020726,0207,02,"TURKEY MEAT AND EDIBLE OFFAL, FRESH OR CHILLED"
020727,0207,02,"LIVERS OF TURKEYS, FROZEN"
020741,0207,02,"DUCKS, WHOLE, FRESH OR CHILLED"
020742,0207,02,"DUCKS, WHOLE, FROZEN"
020743,0207,02,"LIVERS OF DUCKS, FATTY, FRESH OR CHILLED"
020744,0207,02,"MEAT AND EDIBLE OFFAL OF DUCKS, FRESH OR CHILLED, EXCEPT WHOLE DUCKS OR FATTY LIVERS"
020745,0207,02,"LIVERS OF DUCKS, FROZEN"
020751,0207,02,"GEESE, WHOLE, FRESH OR CHILLED"
020752,0207,02,"GEESE, WHOLE, FROZEN"
020753,0207,02,"LIVERS OF GEESE, FATTY, FRESH OR CHILLED"
020754,0207,02,"MEAT AND EDIBLE OFFAL OF GEESE, FRESH OR CHILLED, EXCEPT WHOLE GEESE OR FATTY LIVERS"
020755,0207,02,"LIVERS OF GEESE, FROZEN"
020760,0207,02,"GUINEA FOWLS, WHOLE, FRESH OR CHILLED"
020810,0208,02,"MEAT AND EDIBLE OFFAL OF RABBITS OR HARES, FRESH, CHILLED OR FROZEN"
020830,0208,02,"MEAT AND EDIBLE OFFAL OF PRIMATES, FRESH, CHILLED OR FROZEN"
020840,0208,02,"MEAT AND EDIBLE OFFAL OF WHALES, DOLPHINS AND PORPOISES (CETACEA); OF MANATEES AND DUGONGS (SIRENIA); FRESH, CHILLED OR FROZEN"
020850,0208,02,"MEAT AND EDIBLE OFFAL OF REPTILES (INCLUDING SNAKES AND TURTLES), FRESH, CHILLED OR FROZEN"
020860,0208,02,"MEAT AND EDIBLE OFFAL, OF CAMELS AND OTHER CAMELIDS (CAMELIDAE), FRESH, CHILLED OR FROZEN, NESOI"
020890,0208,02,"MEAT AND EDIBLE OFFAL OF DEER, FRESH, CHILLED OR FROZEN"
020910,0209,02,"PIG FAT, FREE OF LEAN MEAT, NOT RENDERED OR OTHERWISE EXTRACTED, FRESH, CHILED, FROZEN, SALTED, IN BRINE, DRIED OR SMOKED"
020990,0209,02,"POULTRY FAT, NOT RENDERED OR OTHERWISE EXTRACTED, FRESH, CHILLED, FROZEN, SALTED, IN BRINE, DRIED OR SMOKED"
021011,0210,02,"HAMS AND CUTS THEREOF, OF SWINE, WITH BONE IN, SALTED, IN BRINE, DRIED OR SMOKED"
021012,0210,02,BACON OF SWINE
021019,0210,02,"BACON OF SWINE, CANADIAN STYLE"
021020,0210,02,"MEAT OF BOVINES, SALTED, IN BRINE, DRIED OR SMOKED"
021091,0210,02,"MEAT AND EDIBLE OFFAL OF PRIMATES, SALTED, IN BRINE, DRIED OR SMOKED, INCLUDING EDIBLE FLOURS AND MEALS"
021092,0210,02,"MEAT & EDIBLE OFFAL, OF WHALES, DOLPHINS, PORPOISES, MANATEES,DUGONGS,SEALS,SEAL LIONS,WALRUS, SALTED, IN BRINE, DRD, SMOKD, INC EDIBLE FLOURS & MEALS"
021093,0210,02,"MEAT AND EDIBLE OFFAL OF REPTILES, SALTED, IN BRINE, DRIED OR SMOKED, INCLUDING EDIBLE FLOURS AND MEALS"
021099,0210,02,"MEAT AND EDIBLE OFFAL OF CHICKENS, DUCKS, GEESE, TURKEYS AND GUINEA FOWLS, SALTED, IN BRINE, DRIED OR SMOKED, INCLUDING EDIBLE FLOURS AND MEALS"
030111,0301,03,"KOI (COMMON) CARP (CYPRINUS CARPIO), LIVE"
030119,0301,03,"FISH, ORNAMENTAL, LIVE, OTHER THAN FRESHWATER"
030191,0301,03,"TROUT (SALMO TRUTTA, ONCORHYNCHUS MYKISS, CLARKI, AGUABONITA, GILAE, APACHE AND CHRYSOGASTER), LIVE"
030192,0301,03,"EELS (ANGUILLA SPP.), LIVE"
030193,0301,03,"GRASS CARP (CTENOPHARYNGODON IDELLUS), AND SILVER CARP (HYPOPHTHALMICHTHYS MOLITRIX), LIVE"
030194,0301,03,"ATLANTIC AND PACIFIC BLUEFIN TUNAS (THUNNUS THYNNUS, THUNNUS ORIENTALIS), LIVE"
030195,0301,03,"SOUTHERN BLUEFIN TUNAS (THUNNUS MACCOYII), LIVE"
030199,0301,03,"TENCH (TINCA TINCA) AND SHEATFISH (SILURUS GLANIS), LIVE"
030211,0302,03,"RAINBOW TROUT (SALMO GAIRDNERI), FARMED, FRESH OR CHILLED, EXCEPT FILLETS, LIVERS AND ROES"
030213,0302,03,"CHINOOK (KING) SALMON, FARMED, FRESH OR CHILLED, EXCEPT FILLETS, LIVERS AND ROES"
030214,0302,03,"ATLANTIC SALMON (SALMO SALAR), FARMED, FRESH OR CHILLED, EXCEPT FILLETS, LIVERS AND ROES"
030219,0302,03,"SALMONIDAE, FRESH OR CHILLED, EXCEPT FILLETS, LIVERS AND ROES, NESOI"
030221,0302,03,"ATLANTIC HALIBUT (HIPPOGLOSSUS HIPPOGLOSSUS), FRESH OR CHILLED, EXCEPT FILLETS, LIVERS AND ROES"
030222,0302,03,"PLAICE (PLEURONECTES PLATESSA), FRESH OR CHILLED, EXCEPT FILLETS, LIVERS AND ROES"
030223,0302,03,"SOLE (SOLEA SPP.), FRESH OR CHILLED, EXCEPT FILLETS, LIVERS AND ROES"
030224,0302,03,"TURBOTS (PSETTA MAXIMA), FRESH OR CHILLED, EXCLEPT FILLETS, LIVERS AND ROES"
030229,0302,03,"FLOUNDER, FRESH OR CHILLED, EXCEPT FILLETS, LIVERS AND ROES"
030231,0302,03,"ALBACORE OR LONGFINNED TUNAS (THUNNUS ALALUNGA), FRESH OR CHILLED, EXCEPT FILLETS, LIVERS AND ROES"
030232,0302,03,"YELLOWFIN TUNAS (THUNNUS ALBACARES), FRESH OR CHILLED, EXCEPT FILLETS, LIVERS AND ROES"
030233,0302,03,"SKIPJACK TUNA (STRIPE-BELLIED BONITO) (KATSUWONUS PELAMIS), FRESH OR CHILLED, EXCLUDING FISH FILLETS AND OTHER FISH MEAT OF HEADING 0304"
030234,0302,03,"BIGEYE TUNAS (THUNNUS OBESUS), FRESH OR CHILLED, EXCEPT FILLETS, LIVERS AND ROES"
030235,0302,03,"ATLANTIC AND PACIFIC BLUEFIN TUNAS (THUNNUS THYNNUS, THUNNUS ORIENTALIS), FRESH OR CHILLED, EXCEPT FILLETS, LIVERS AND ROES"
030236,0302,03,"SOUTHERN BLUEFIN TUNAS (THUNNUS MACCOYII), FRESH OR CHILLED, EXCEPT FILLETS, LIVERS AND ROES"
030239,0302,03,"TUNAS (OF GENUS THUNNUS), FRESH OR CHILLED, EXCEPT FILLETS, LIVERS AND ROES, NESOI"
030241,0302,03,"HERRINGS (CLUPEA HARENGUS, CLUPEA PALLASII), FRESH OR CHILLED, EXCEPT FILLETS, LIVERS AND ROES"
030242,0302,03,"ANCHOVIES, FRESH OR CHILLED, EXCLUDING LIVERS, ROES, FILLETS AND OTHER FISH MEAT OF HEADING 0304"
030243,0302,03,"SARDINES (SARDINA PILCHARDUS, SARDINOPS SPP.), SARDINELLA (SARDINELLA SPP.), BRISLING OR SPRATS (SPRATTUS SPRATTUS), FR/CH, EXCEPT FILLET, LIVER, ROE"
030244,0302,03,"MACKEREL (SCOMBER SCOMBRUS, SCOMBER AUSTRALASICUS, SCOMBER JAPONICUS), FRESH OR CHILLED, EXCEPT FILLETS, LIVERS AND ROES"
030245,0302,03,"JACK AND HORSE MACKEREL , FRESH/CHILLED, SCALED, IN IMMEDIATE CONTAINERS WEIGHING WITH THEIR CONTENTS 6.8 KG OR LESS, EXCEPT FILLETS, LIVERS AND ROES"
030246,0302,03,"COBIA, FRESH OR CHILLED, SCALED, IN IMMEDIATE CONTAINERS WEIGHING WITH THEIR CONTENTS 6.8 KG OR LESS, EXCEPT FILLETS, LIVERS AND ROES"
030247,0302,03,"SWORDFISH STEAKS, FRESH OR CHILLED, EXCEPT FILLETS, LIVERS AND ROES, NESOI"
030249,0302,03,"INDIAN MACKRLS,SEERFISHES, JACKS, CREVALLES, SILVER POMFRETS, PACIFIC SAURY,SCADS,CAPELIN,KAWAKAWA, BONITOS,MARLINS,SAILFISHES,SPEARFISH,FRESH/CHILLED"
030251,0302,03,"ATLANTIC COD (GADUS MORHUA), FRESH OR CHILLED, EXCEPT FILLETS, LIVERS AND ROES"
030252,0302,03,"HADDOCK (MELANOGRAMMUS AEGLEFINUS), FRESH OR CHILLED, EXCEPT FILLETS, LIVERS AND ROES"
030253,0302,03,"ATLANTIC POLLOCK (POLLACHIUS VIRENS), FRESH OR CHILLED, EXCEPT FILLETS, LIVERS AND ROES"
030254,0302,03,"HAKE, FRESH OR CHILLED, SCALED, IN IMMEDIATE CONTAINERS WEIGHING WITH THEIR CONTENTS 6.8 KG OR LESS, EXCEPT FILLETS, LIVERS AND ROES"
030255,0302,03,"ALASKA POLLOCK, FRESH OR CHILLED, SCALED, IN IMMEDIATE CONTAINERS WEIGHING WITH THEIR CONTENTS 6.8 KG OR LESS, EXCEPT FILLETS, LIVERS AND ROES"
030256,0302,03,"BLUE WHITINGS, FRESH OR CHILLED, SCALED, IN IMMEDIATE CONTAINERS WEIGHING WITH THEIR CONTENTS 6.8 KG OR LESS, EXCEPT FILLETS, LIVERS AND ROES"
030259,0302,03,"FISH OF FAMILES BREGMACEROTIDAE, ETC; FR/CH, SCALED, IN CONTAINERS WEIGHING WITH THEIR CONTENTS 6.8 KG OR LESS, EXCEPT FILLETS, LIVERS AND ROES, NESOI"
030271,0302,03,"TILAPIAS, FRESH OR CHILLED, SCALED, IN IMMEDIATE CONTAINERS WEIGHING WITH THEIR CONTENTS 6.8 KG OR LESS, EXCEPT FILLETS, LIVERS AND ROES"
030272,0302,03,"CATFISH, FRESH OR CHILLED, SCALED, IN IMMEDIATE CONTAINERS WEIGHING WITH THEIR CONTENTS 6.8 KG OR LESS, EXCEPT FILLETS, LIVERS AND ROES"
030273,0302,03,"CARP, FRESH OR CHILLED, SCALED, IN IMMEDIATE CONTAINERS WEIGHING WITH THEIR CONTENTS 6.8 KG OR LESS, EXCEPT FILLETS, LIVERS AND ROES"
030274,0302,03,"EELS (ANGUILLA SPP.), FRESH OR CHILLED, EXCEPT FILLETS, LIVERS AND ROES"
030279,0302,03,"SNAKEHEADS, FRESH OR CHILLED, SCALED, IN IMMEDIATE CONTAINERS WEIGHING WITH THEIR CONTENTS 6.8 KG OR LESS, EXCEPT FILLETS, LIVERS AND ROES"
030281,0302,03,"DOGFISH (SQUALUS SPP.), FRESH OR CHILLED, EXCEPT FILLETS, LIVERS AND ROES"
030282,0302,03,"RAYS AND SKATES, FRESH OR CHILLED, EXCLUDING LIVERS, ROES, FILLETS AND OTHER FISH MEAT OF HEADING 0304, NESOI"
030283,0302,03,"TOOTHFISH (DISSOSTICHUS SPP.), FRESH OR CHILLED, EXCLUDING FILLETS, LIVERS AND ROES"
030284,0302,03,"SEABASS, FRESH OR CHILLED, SCALED, IN IMMEDIATE CONTAINERS WEIGHING WITH THEIR CONTENTS 6.8 KG OR LESS, EXCEPT FILLETS, LIVERS AND ROES"
030285,0302,03,"SEABREAM (SPARIDAE), FRESH OR CHILLED, SCALED, IN IMMEDIATE CONTAINERS WEIGHING WITH THEIR CONTENTS 6.8 KG OR LESS, EXCEPT FILLETS, LIVERS AND ROES"
030289,0302,03,"SABLE FISH (ANOPLOPOMA FIMBRIA), FRESH OR CHILLED, SCALED, IN IMMEDIATE CONTAINERS WEIGHING WITH CONTENTS 6.8 KG OR LESS, EXCEPT FILLETS, LIVERS, ROES"
030291,0302,03,"STURGEON ROE, FRESH OR CHILLED"
030292,0302,03,"SHARK FINS, FRESH OR CHILLED, EXCEPT FILLETS"
030299,0302,03,"OTHER EDIBLE FISH OFFAL, FRESH OR CHILLED, NESOI"
030311,0303,03,"SOCKEYE (RED) SALMON (ONCORHYNCHUS NERKA), FROZEN, EXCEPT FILLETS, LIVERS AND ROES"
030312,0303,03,"CHINOOK (KING) SALMON (ONCORHYNCHUS TSCHAWYTSCHA), FROZEN, EXCEPT FILLETS, LIVERS AND ROES"
030313,0303,03,"ATLANTIC SALMON (SALMO SALAR) AND DANUBE SALMON (HUCHO HUCHO), FROZEN, EXCEPT FILLETS, LIVERS AND ROES"
030314,0303,03,"TROUT (SALMO TRUTTA; ONCORHYNCHUS MYKISS, CLARKI, AGUABONITA, GILAE, APACHE AND CHRYSOGASTER), FROZEN, EXCEPT FILLETS, LIVERS AND ROES"
030319,0303,03,"SALMONIDAE, FROZEN, EXCEPT FILLETS, LIVERS AND ROES, NESOI"
030323,0303,03,"TILAPIA (OREOCHROMIS SPP.), FROZEN, EXCEPT FILLETS, LIVERS AND ROES"
030324,0303,03,"ICTALURUS SPP, FROZEN, EXCEPT FILLETS, LIVERS AND ROES, NESOI"
030325,0303,03,"CARP, FROZEN, EXCEPT FILLETS, LIVERS AND ROES"
030326,0303,03,"EELS (ANGUILLA SPP.), FROZEN, EXCEPT FILLETS, LIVERS AND ROES"
030329,0303,03,"NILE PERCH, FROZEN, EXCEPT FILLETS, LIVERS AND ROES"
030331,0303,03,"ATLANTIC HALIBUT (HIPPOGLOSSUS HIPPOGLOSSUS), FROZEN, EXCEPT FILLETS, LIVERS AND ROES"
030332,0303,03,"PLAICE (PLEURONECTES PLATESSA), FROZEN, EXCEPT FILLETS, LIVERS AND ROES"
030333,0303,03,"SOLE (SOLEA SPP.), FROZEN, EXCEPT FILLETS, LIVERS AND ROES"
030334,0303,03,"TURBOTS, FROZEN, EXCEPT FILLETS, LIVERS AND ROES"
030339,0303,03,"FLOUNDER, FROZEN, EXCEPT FILLETS, LIVERS AND ROES, NESOI"
030341,0303,03,"ALBACORE OR LONGFINNED TUNAS (THUNNUS ALALUNGA), FROZEN, EXCEPT FILLETS, LIVERS AND ROES"
030342,0303,03,"YELLOWFIN TUNAS (THUNNUS ALBACARES), WHOLE, FROZEN"
030343,0303,03,"SKIPJACK TUNA (STRIPE-BELLIED BONITO) (KATSUWONUS PELAMIS), FROZEN, EXCLUDING FISH FILLETS AND OTHER FISH MEAT OF HEADING 0304"
030344,0303,03,"BIGEYE TUNAS (THUNNUS OBESUS), FROZEN, EXCEPT FILLETS, LIVERS AND ROES"
030345,0303,03,"BLUEFIN TUNAS (THUNNUS THYNNUS), FROZEN, EXCEPT FILLETS, LIVERS AND ROES"
030346,0303,03,"SOUTHERN BLUEFIN TUNAS (THUNNUS MACCOYII), FROZEN, EXCEPT FILLETS, LIVERS AND ROES"
030349,0303,03,"TUNAS (OF THE GENUS THUNNUS), FROZEN, EXCEPT FILLETS, LIVERS AND ROES, NESOI"
030351,0303,03,"HERRINGS (CLUPEA HARENGUS, CLUPEA PALLASII), FROZEN, EXCEPT FILLETS, LIVERS AND ROES"
030353,0303,03,"SARDINES (SARDINA PILCHARDUS, SARDINOPS SPP.), SARDINELLA (SARDINELLA SPP.), BRISLING OR SPRATS (SPRATTUS SPRATTUS), FRZN EXCEPT FILLET, LIVER AND ROE"
030354,0303,03,"MACKEREL (SCOMBER SCOMBRUS, SCOMBER AUSTRALASICUS, SCOMBER JAPONICUS), FROZEN, EXCEPT FILLETS, LIVERS AND ROES"
030355,0303,03,"JACK AND HORSE MACKEREL, FROZEN, EXCEPT FILLETS, LIVERS AND ROES"
030356,0303,03,"COBIA, FROZEN, EXCEPT FILLETS, LIVERS AND ROES"
030357,0303,03,"SWORDFISH STEAKS, FROZEN, EXCEPT FILLETS"
030359,0303,03,"FISH, FROZEN, EXCEPT FILLETS, LIVERS AND ROES, HERRINGS (CLUPEA HARENGUS, CLUPEA PALLASII)"
030363,0303,03,"ATLANTIC COD (GADUS MORHUA), FROZEN, EXCEPT FILLETS, LIVERS AND ROES"
030364,0303,03,"HADDOCK (MELANOGRAMMUS AEGLEFINUS), FROZEN, EXCEPT FILLETS, LIVERS AND ROES"
030365,0303,03,"ATLANTIC POLLOCK (POLLACHIUS VIRENS), FROZEN, EXCEPT FILLETS, LIVERS AND ROES"
030366,0303,03,"WHITING (MERLUCCIUS SPP.) AND HAKE (UROPHYCIS SPP.), FROZEN, EXCEPT FILLETS, LIVERS AND ROES"
030367,0303,03,"ALASKA POLLOCK (THERAGRA CHALCOGRAMMA), FROZEN, EXCLUDING LIVERS, ROES, FILLETS AND OTHER FISH MEAT OF HEADING 0304"
030368,0303,03,"BLUE WHITINGS, FROZEN, EXCEPT FILLETS, LIVERS AND ROES"
030369,0303,03,"FISH OF FAMILIES BREGMAVEROTIDAE, EUCLICHTHYIDAE, GADIDAE, ETC; FROZEN, EXCEPT FILLETS, LIVERS AND ROES, NESOI"
030381,0303,03,"DOGFISH (SQUALUS SPP.), FROZEN, EXCEPT FILLETS, LIVERS AND ROES"
030382,0303,03,"RAYS AND SKATES, FROZEN, EXCEPT FILLETS, LIVERS AND ROES"
030383,0303,03,"TOOTHFISH (DISSOSTICHUS SPP.), FROZEN, EXCLUDING FISH FILLETS, LIVERS AND ROES"
030384,0303,03,"SEA BASS (DICENTRARCHUS LABRAX, DICENTRARCHUS PUNCTATUS), FROZEN, EXCEPT FILLETS, LIVERS AND ROES"
030389,0303,03,"SEA SMELTS, FROZEN, EXCEPT FILLETS, LIVERS AND ROES"
030391,0303,03,"STURGEON ROE, FROZEN"
030392,0303,03,"SHARK FINS, FROZEN, EXCEPT FILLETS"
030399,0303,03,"OTHER EDIBLE FISH OFFAL, FROZEN, NESOI"
030431,0304,03,"TILAPIA (OREOCHROMIS) FILLETS, FRESH OR CHILLED"
030432,0304,03,"ICTALURUS SPP FILLETS, FRESH OR CHILLED"
030433,0304,03,"NILE PERCH FILLETS, FRESH OR CHILLED"
030439,0304,03,"CARP, EEL OR SNAKEHEAD FILLETS, FRESH OR CHILLED"
030441,0304,03,"ATLANTIC SALMON (SALMO SALAR) FILLETS, FARMED, FRESH OR CHILLED"
030442,0304,03,"TROUT FILLETS, FRESH OR CHILLED"
030443,0304,03,"SOLE FILLETS, FRESH OR CHILLED"
030444,0304,03,"ATLANTIC COD, FILLETS, FRESH OR CHILLED"
030445,0304,03,"SWORDFISH (XIPHIAS GLADIUS), FILLETS, FRESH OR CHILLED"
030446,0304,03,"TOOTHFISH (DISSOSTICHUS SPP), FILLETS, FRESH OR CHILLED"
030447,0304,03,"DOGFISH FILLETS, AND OTHER SHARK FILLETS, FRESH OR CHILLED"
030448,0304,03,"RAY AND SKATE (RAJIDAE) FILLETS, FRESH OR CHILLED"
030449,0304,03,"PIKE FILLETS, FRESH OR CHILLED"
030451,0304,03,"ICTALURUS SPP MEAT (WHETHER OR NOT MINCED), OTHER THAN FILLETS, FRESH OR CHILLED"
030452,0304,03,"ATLANTIC SALMON (SALMO SALAR) MEAT OTHER THAN FILLETS, FARMED, FRESH OR CHILLED"
030453,0304,03,"ATLANTIC COD, MEAT OTHER THAN FILLETS, FRESH OR CHILLED"
030454,0304,03,"SWORDFISH (XIPHIAS GLADIUS), FISH MEAT, OTHER THAN FILLETS, FRESH OR CHILLED, NES"
030455,0304,03,"TOOTHFISH (DISSOSTICHUS SPP), FRESH OR CHILLED, EXCLUDING FILLETS"
030456,0304,03,DOGFISH & OTHER SHARKS FRESH OR CHILLED
030457,0304,03,"RAYS AND SKATES (RAJIDAE), FRESH OR CHILLED"
030459,0304,03,"YELLOW PERCH FILLETS AND OTHER MEAT, FRESH OR CHILLED"
030461,0304,03,"TILAPIA FILLETS, FROZEN"
030462,0304,03,"ICTALURUS SPP FILLETS, FROZEN"
030463,0304,03,"NILE PERCH FILLETS, FROZEN"
030469,0304,03,"CARP, EELS AND SNAKEHEAD FILLETS, FROZEN"
030471,0304,03,"COD FILLETS, SKINNED, FROZEN BLOCKS WEIGHING OVER 4.5 KG EACH, TO BE MINCED, GROUND OR CUT INTO PIECES OF UNIFORM WEIGHTS AND DIMENSIONS"
030472,0304,03,"HADDOCK FILLETS, SKINNED, FROZEN BLOCKS WEIGHING OVER 4.5 KG EACH, IMPORTED TO BE MINCED, GROUND OR CUT INTO PIECES OF UNIFORM WEIGHTS AND DIMENSIONS"
030473,0304,03,"COALFISH (POLLACHIUS VIRENS) FILLETS,SKIND, FZ BLOCKS WEIGHING OVER 4.5 KG EA, TO BE MINCED, GROUND OR CUT INTO PIECES OF UNIFORM WEIGHTS & DIMENSIONS"
030474,0304,03,"HAKE FILLETS, SKINNED, FROZEN BLOCKS WEIGHING OVER 4.5 KG EACH, TO BE MINCED, GROUND OR CUT INTO PIECES OF UNIFORM WEIGHTS AND DIMENSIONS"
030475,0304,03,"ALASKA POLLOCK (THERAGRA CHALCOGRAMMA) FILLETS, SKINNED, FROZEN BLOCKS WEIGHING OVER 4.5 KG EACH, TO BE MINCED, GROUND OR CUT INTO PIECES ETC"
030479,0304,03,"POLLOCK FILLETS, SKINNED, FROZEN BLOCKS WGT OVER 4.5 KG EA, TO BE MINCED, GROUND OR CUT INTO PIECES OF UNIFORM WEIGHTS & DIMENSIONS, NESOI"
030481,0304,03,"PACIFIC, ATLANTIC & DANUBE SALMON FILLETS,SKINNED,FZ,WGT OVER 4.5 KG EACH,TO BE MINCED, GROUND OR CUT TO PIECES OF UNIFORM WEIGHTS & DIMENSIONS, NESOI"
030482,0304,03,"TROUT FILLETS, SKINNED, FROZEN BLOCKS WEIGHING OVER 4.5 KG EACH, TO BE MINCED, GROUND OR CUT INTO PIECES OF UNIFORM WEIGHTS AND DIMENSIONS"
030483,0304,03,"GREENLAND TURBOT (GREENLAND HALIBUT; REINHARDTIUS HIPPOGLOSSOIDES) FILLETS, SKINNED, FROZEN BLOCKS WEIGHING OVER 4.5 KG EACH, TO BE MINCED, GROUND ETC"
030484,0304,03,"SWORDFISH (XIPHIAS GLADIUS) FILLETS, FROZEN"
030485,0304,03,"TOOTHFISH (DISSOSTICHUS SPP.) FILLETS, FROZEN"
030486,0304,03,"HERRING FILLETS, FROZEN"
030487,0304,03,"SKIPJACK TUNA (STRIPE-BELLIED BONITO) (KATSUWONUS PELAMIS) FILLETS AND OTHER FISH MEAT WHETHER OR NOT MINCED, FROZEN"
030488,0304,03,"DOGFISH, OTHER SHARKS, RAYS AND SKATES (RAJIDAE) FILLETS, FROZEN"
030489,0304,03,"OCEAN CATFISH (WOLF FISH) FILLETS, SKINNED, FROZEN BLOCKS WEIGHING OVER 4.5 KG EACH, TO BE MINCED, GROUND OR CUT INTO PIECES OF UNIFORM WEIGHTS ETC"
030491,0304,03,"SWORDFISH, FROZEN, IN BULK OR IN IMMEDIATE CONTAINERS WEIGHING WITH THEIR CONTENTS OVER 6.8 KG EACH"
030492,0304,03,"TOOTHFISH, FROZEN, IN BULK OR IN IMMEDIATE CONTAINERS WEIGHING WITH THEIR CONTENTS OVER 6.8 KG EACH"
030493,0304,03,"TILAPIA, CATFISH, CARP, EELS, NILE PERCH, SNAKEHEAD SURIMI, MINCED, FROZEN,IN BULK OR IN IMMEDIATE CONTAINERS  WITH THEIR CONTENTS OVER 6.8 KG EACH"
030494,0304,03,"SURIMI OF ALASKA POLLOCK, FROZEN, IN BULK OR IN IMMEDIATE CONTAINERS WEIGHING WITH THEIR CONTENTS OVER 6.8 KG EACH"
030495,0304,03,"FISH OF FAMILIES BREGMACEROTIDAE, ETC., SURIMI, FZ, IN BULK OR IN IMMEDIATE CONTAINERS WEIGHING WITH THEIR CONTENTS OVER 6.8 KG EACH"
030496,0304,03,"DOGFISH AND OTHER SHARKS, FROZEN, NESOI"
030497,0304,03,"RAY AND SKATES (RAJIDAE), FROZEN, NESOI"
030499,0304,03,"SURIMI, FROZEN, IN BULK OR IN IMMEDIATE CONTAINERS WEIGHING WITH THEIR CONTENTS OVER 6.8 KG EACH, EXCEPT ALASKA POLLOCK, NESOI"
030520,0305,03,"STURGEON ROE, DRIED, SMOKED, SALTED OR IN BRINE"
030531,0305,03,"TILAPIA, CATFISH, CARP, EEL, NILE PERCH AND SNAKEHEAD FILLETS, DRIED, SALTED OR IN BRINE, BUT NOT SMOKED"
030532,0305,03,"COD FILLETS, DRIED, SALTED OR IN BRINE, BUT NOT SMOKED"
030539,0305,03,"HERRING FILLETS, DRIED, SALTED OR IN BRINE, IN IMMEDIATE CONTAINERS WEIGHING WITH THEIR CONTENTS 6.8 KG OR LESS EACH, NOT SMOKED"
030541,0305,03,"PACIFIC SALMON (ONCORHYNCHUS SPP.), ATLANTIC SALMON (SALMO SALAR), AND DANUBE SALMON (HUCHO HUCHO), INCLUDING FILLETS, SMOKED"
030542,0305,03,"HERRINGS (CLUPEA HARENGUS, CLUPEA PALLASII), WHOLE OR BEHEADED BUT NOT OTHERWISE PROCESSED, SMOKED"
030543,0305,03,"SMOKED TROUT, INCLUDING FILLETS, OTHER THAN EDIBLE OFFAL"
030544,0305,03,"SMOKED TILAPIA, CATFISH, CARP, EELS, NILE PERCH AND SNAKEHEADS INCLUDING FILLETS, OTHER THAN EDIBLE FISH OFFAL"
030549,0305,03,"MACKEREL, INCLUDING FILLETS, SMOKED"
030551,0305,03,"COD (GADUS MORHUA, GADUS OGAC, GADUS MACROCEPHALUS), DRIED, WHETHER OR NOT SALTED BUT NOT SMOKED"
030552,0305,03,"TIALPIA, CATFISH,EELS,NILE PERCH AND SNAKEHEADS, FISH DRIED, WHETHER OR NOT SALTED BUT NOT SMOKED"
030553,0305,03,"FISH OF FAMILIES BREGMACEROTIDAE, EUCLICHTHYIDAE, GADIDAE, MACROURIDAE,MELANONIDAE,MERCLUCCIIDAE,MORIDAE&MURAENOLEPIDIDAE,OTH/THAN COD,DRIED,WHTH/NOT"
030554,0305,03,"HERRINGS,ANCHOVIES,SARDINES,SARDINELLA,BRISLING/SPRATS,MACKEREL,INDIAN MACK,SEERFSH,JACK/HORSE MACK, DRIED, WHETHER OR NOT SALTED BUT NOT SMOKED"
030559,0305,03,"FISH, DRIED, WHETHER OR NOT SALTED BUT NOT SMOKED, NESOI"
030561,0305,03,"HERRINGS (CLUPEA HARENGUS, CLUPEA PALLASII), SALTED, IN IMMEDIATE CONTAINERS WEIGHING WITH CONTENTS 6.8 KG OR LESS, NOT DRIED OR SMOKED OR IN BRINE"
030562,0305,03,"COD HAVING A MOISTURE CONT BY WEIGHT OVER 50%, WHOLE/PROCESSED BY REMOVAL OF HEADS/FINS/VISCERA/SCALES/VERTEBRAL COLUMNS, SALTD NOT DRD/SMKD; IN BRINE"
030563,0305,03,"ANCHOVIES (ENGRAULIS SPP.) IN AIRTIGHT CONTAINERS WEIGHING WITH THEIR CONTENTS 6.8 KG OR LESS EACH, SALTED BUT NOT DRIED OR SMOKED; IN BRINE"
030564,0305,03,"TILAPIA, CATFISH, CARP, EELS, NILE PERCH AND SNAKEHEAD FLOURS,ETC,CONTS WEIGH W/THEIR CONTNTS 6.8 KG OR LESS EACH, SALT BUT NOT DRIED/SMOKED; IN BRINE"
030569,0305,03,"HAKE, WHOLE OR PROCESSED BY REMOVAL OF HEADS, FINS, VISCERA, SCALES, VERTEBRAL COLUMNS OR ANY COMBINATION THEREOF, SALTED NT DRIED OR SMOKED; IN BRINE"
030571,0305,03,"SHARK FINS, DRIED OR SMOKED"
030572,0305,03,"FISH HEADS, TAILS AND MAWS"
030579,0305,03,"EDIBLE FISH OFFAL, DRIED, SALTED, IN BRINE OR SMOKED, NESOI"
030611,0306,03,"CARIBBEAN SPINY LOBSTER (PANULIRUS ARGUS), FROZEN"
030612,0306,03,"LOBSTERS (HOMARUS SPP.) IN AIRTIGHT CONTAINERS, IN BRINE, FROZEN"
030614,0306,03,"CRABMEAT, FROZEN"
030615,0306,03,"NORWAY LOBSTERS (NEPHROPS NORVEGICUS), FROZEN"
030616,0306,03,"COLD-WATER SHRIMPS AND PRAWNS (PANDALUS SPP., CRANGON CRANGON), FROZEN, SHELL-ON, COUNT SIZE (HEADLESS WEIGHT) LESS THAN 33 PER KG (15S), STAT NOTE 1"
030617,0306,03,"FARMED SHRIMPS AND PRAWNS (PANDALUS SPP., CRANGON CRANGON) FROZEN, SHELL-ON, COUNT SIZE (HEADLESS WEIGHT) LESS THAN 33 PER KG (15S), STAT NOTE 1 NESOI"
030619,0306,03,"FRESHWATER CRAWFISH, INCLUDING IN SHELL, COOKED BY STEAMING OR BY BOILING IN WATER, FROZEN"
030631,0306,03,"ROCK LOBSTER AND OTHER SEA CRAWFISH (PALINURUS SPP., PANULIRUS SPP.,  JASUS SPP), LIVE, FRESH OR CHILLED"
030632,0306,03,"LOBSTERS (HOMARUS SPP.), LIVE, EXCEPT ROCK LOBSTER"
030633,0306,03,"CRABMEAT, FRESH OR CHILLED"
030634,0306,03,"NORWAY LOBSTERS (NEPHROPS NORVEGICUS), LIVE, FRESH OR CHILLED"
030635,0306,03,"COLD-WATER SHRIMPS AND PRAWNS (PANDALUS SPP., CRANGON CRANGON), LIVE, FRESH OR CHILLED, SHELL-ON"
030636,0306,03,"SHRIMPS AND PRAWNS, LIVE, FRESH OR CHILLED, SHELL-ON, OTHER THAN COLD-WATER"
030639,0306,03,"CRUSTACEANS WHETHER IN SHELL OR NOT, LIVE, FRESH OR CHILLED, NESOI"
030691,0306,03,"ROCK LOBSTER AND OTHER SEA CRAWFISH (PALINURUS SPP., PANULIRUS SPP.,  JASUS SPP), NESOI"
