HS6,HS4,HS2,Description
293972,2939,29,"COCAINE, ECGONINE; SALTS, ESTERS AND OTHER DERIVATIVES THEREOF"
293979,2939,29,"VEGETABLE ALKALOIDS, NATURAL OR REPRODUCED BY SYNTHESIS, THEIR SALTS AND OTHER DERIVATIVES, NESOI"
293980,2939,29,SAXITOXIN
294000,2940,29,D-ARABINOSE
294110,2941,29,AMPICILLIN AND ITS SALTS
294120,2941,29,DIHYDROSTREPTOMYCIN AND ITS DERIVATIVES; SALTS THEREOF
294130,2941,29,TETRACYCLINES AND THEIR DERIVATIVES; SALTS THEREOF
294140,2941,29,CHLORAMPHENICOL AND ITS DERIVATIVES; SALTS THEREOF
294150,2941,29,ERYTHROMYCIN AND ITS DERIVATIVES; SALTS THEREOF
294190,2941,29,AMINOGLYCOSIDE ANTIBIOTICS
294200,2942,29,"[2,2'-THIOBIS(4-1,1,3,3-TETRA-METHYL-N-BUTYL)PHENOLATO)(2,1)]-O,O',S-S(1-BUTANAMINE),NICKEL II"
300120,3001,30,EXTRACTS OF GLANDS OR OTHER ORGANS OR OF THEIR SECRETIONS
300190,3001,30,"LIVER, DRIED, WHETHER OR NOT POWDERED"
300212,3002,30,HUMAN BLOOD PLASMA
300213,3002,30,"MONOCLONAL ANTIBODIES, UNMIXED, NOT PUT UP IN MEASURED DOSES OR IN FORMS OR PACKINGS FOR RETAIL SALE"
300214,3002,30,"IMMUNOLOGICAL PRODUCTS CONTAINING MONOCLONAL ANTIBODIES, MIXED, NOT PUT UP IN MEASURED DOSES OR IN FORMS OR PACKINGS FOR RETAIL SALE"
300215,3002,30,"DIAGNOSTIC REAGENTS BASED ON AN ANTIBODY TEST, PUT UP IN MEASURED DOSES OR IN FORMS OR PACKINGS FOR RETAIL SALE"
300241,3002,30,"VACCINES FOR HUMAN MEDICINE, NESOI"
300242,3002,30,VACCINES FOR VETERINARY MEDICINE
300249,3002,30,RICIN
300251,3002,30,CELL THERAPY PRODUCTS
300259,3002,30,"CELL CULTURES, WHETHER OR NOT MODIFIED, NESOI"
300290,3002,30,FERMENTS
300310,3003,30,"MEDICAMENTS (EXCLUD GOODS OF 3002, 3005, OR 3006) CONTAING PENICILLINS OR DERIVATIVES THEREOF,OR STREPTOMYCINS OR THEIR DERIVATIVES"
300320,3003,30,MEDICAMENTS CONTAINING OTHER ANTIBIOTICS (EXCLUDING PENICILLINS AND STREPTOMYCINS
300331,3003,30,MEDICAMENTS CONTAINING INSULIN BUT NOT ANTIBIOTICS
300339,3003,30,ARTIFICIAL MIXTURES OF NATURAL HORMONES
300341,3003,30,MEDICAMENTS CONTAINING ALKALOIDS OR DERIVATIVES THEREOF: CONTAINING EPHEDRINE OR ITS SALTS
300342,3003,30,MEDICAMENTS CONTAINING ALKALOIDS OR DERIVATIVES THEREOF: CONTAINING PSEUDOPHEDRINE OR ITS SALTS
300343,3003,30,MEDICAMENTS CONTAINING ALKALOIDS OR DERIVATIVES THEREOF: CONTAINING NOREPHEDRINE OR ITS SALTS
300349,3003,30,OTHER MEDICAMENTS CONTAINING ALKALOIDS OR DERIVATIVES THEREOF
300360,3003,30,"OTHER MEDICAMENTS CONTAINING ANTIMALARIAL ACTIVE PRINCIPLES DESCRIBED IN SUBHEADING NOTE 2 TO THIS CHAPTER, NOT IN MEASURED DOSES"
300390,3003,30,"ANTIVIRALS OF TWO OR MORE CONSTITUENTS MIXED TOGETHER, EXCLUDING GOODS OF HEADING 3002, 3005 OR 3006, NOT IN MEASURED DOSES OR FOR RETAIL"
300410,3004,30,MEDICAMENTS CONTAINING PENICILLIN G SALTS FOR VETRINARY USE
300420,3004,30,"MEDICAMENTS CONTAINING OTHER ANTIBIOTICS NOT ELSEWHERE SPECIFIED OR INCLUDED, FOR VETERINARY USE"
300431,3004,30,MEDICAMENTS CONTAINING INSULIN BUT NOT CONTAINING ANTIBIOTICS
300432,3004,30,"MEDICAMENTS CONTAINING CORTICOSTEROID HORMONES, THEIR DERIVATIVES AND STRUCTURAL ANALOGUES"
300439,3004,30,"MEDICAMENTS CONTAINING HORMONES OR OTHER PRODUCTS OF HEADING 2937 BUT NOT CONTAINING ANTIBIOTICS, FOR VETERINARY USE"
300441,3004,30,MEDICAMENTS CONTAINING ALKALOIDS OR DERIVATIVES THEREOF CONTAINING EPHEDRINE OR IT SALTS
300442,3004,30,"MEDICAMENTS CONSISTING OF MIXED/UNMIXED PRODUCTS, CONTAINING ALKALOIDS OR DERIVATIVES THEREOF: CONTAINING PSEUDOEPHEDRINE (INN) OR ITS SALTS"
300443,3004,30,"MEDICAMENTS CONSISTING OF MIXED OR UNMIXED PRODUCTS, CONTAINING ALKALOIDS OR DERIVATIVES THEREOF: CONTAINING NOREPHEDRINE OR ITS SALTS"
300449,3004,30,"MEDICAMENTS CONTAINING MIXED OR UNMIXED PRODUCTS, CONTAINING ALKALOIDS OR DERIVATIVES THEREOF, FOR VETERINARY USE"
300450,3004,30,VITAMIN B2
300460,3004,30,"OTHER MEDICAMENTS CONTAINING ANTIMALARIAL ACTIVE PRINCIPLES DESCRIBED IN SUBHEADING NOTE 2 TO THIS CHAPTER, IN MEASURED DOSES"
300490,3004,30,MEDICAMENTS CONTAINING ANTIGENS OR HYALURONIC ACID OR ITS SODIUM SALT
300510,3005,30,ADHESIVE DRESSINGS COATED OR IMPREGNATED WITH PHARMACEUTICAL SUBSTANCES
300590,3005,30,"STERILE SURGICAL CATGUT, SIMILAR STERILE SUTURE MATERIALS AND STERILESUTURE MATERIALS AND STERILE TISSUE ADHESIVES FOR SURGICAL WOUND CLOSURE ETC"
300610,3006,30,"STERILE SURGICAL CATGUT, SIMILAR STERILE SUTURE MATERIALS AND STERILETISSUE ADHESIVES FOR SURGICAL WOUND CLOSURE; AND SIMILAR STERILE MATERIAL"
300630,3006,30,OPACIFYING PREPARATIONS FOR X-RAY EXAMINATIONS OR DIAGNOSTIC REAGENTSCONTAINING ANTIGENS OR ANTISERA TO BE ADMINISTERED TO THE PATIENT
300640,3006,30,DENTAL CEMENTS AND OTHER DENTAL FILLINGS; BONE RECONSTRUCTION CEMENTS
300650,3006,30,FIRST-AID BOXES AND KITS
300660,3006,30,CHEMICAL CONTRACEPTIVE PREPARATIONS BASED ON HORMONES OR SPERMICIDES
300670,3006,30,"GEL PREPARATIONS FOR USE IN HUMAN AND VETERINARY MEDICINE AS LUBRICANT FOR OPERATIONS OR PHYSICAL EXAMS, AS COUPLING AGENT BTWN BODY & MED INSTRUMENT"
300691,3006,30,APPLIANCES IDENTIFIABLE FOR OSTOMY USE
300692,3006,30,WASTE PHARMACEUTICALS
300693,3006,30,"PLACEBOS AND BLINDED OR DOUBLE-BLINDED CLINICAL TRIAL KITS FOR A RECOGNIZED CLINICAL TRIAL, PUT UP IN MEASURED DOSES; PACKAGED WITH MEDICAL PREP"
310100,3101,31,"ANIMAL/VEG FERTILIZERS, WHETHER OR NOT MIXED TOGETHER OR CHEMICALLY TREATED; FERTILIZERS PRODUCED BY MIXING/CHEMICAL TREATMENT OF ANIMAL/VEG PRODUCTS"
310210,3102,31,SOLID UREA
310221,3102,31,AMMONIUM SULFATE
310229,3102,31,"DOUBLE SALTS AND MIXTURES OF AMMONIUM SULFATE AND AMMONIUM NITRATE, NESOI"
310230,3102,31,"AMMONIUM NITRATE, WHETHER OR NOT IN AQUEOUS SOLUTION"
310240,3102,31,MIXTURES OF AMMONIUM NITRATE WITH CALCIUM CARBONATE OR OTHER INORGANIC NONFERTILIZING SUBSTANCES
310250,3102,31,SODIUM NITRATE
310260,3102,31,DOUBLE SALTS AND MIXTURES OF CALCIUM NITRATE AND AMMONIUM NITRATE
310280,3102,31,MIXTURES OF UREA AND AMMONIUM NITRATE IN AQUEOUS OR AMMONIACAL SOLUTION
310290,3102,31,"OTHER, MINERAL OR CHEMICAL FERTILIZERS, NITROGENEOUS INCLUDING MIXTURES NOT SPECIFIED IN SUBHEADINGS 3102.10 THROUGH 3102.80"
310311,3103,31,SUPERPHOSPHATES CONTAINING BY WEIGHT 35% OR MORE OF PHOSPHORUS PENTOXIDE P205
310319,3103,31,SUPERPHOSPHATES OTHER
310390,3103,31,"MINERAL OR CHEMICAL FERTILIZERS, PHOSPHATIC, NESOI"
310420,3104,31,POTASSIUM CHLORIDE CONTAINING NOT MORE THAN 62% BY WEIGHT OF POTASSIUM OXIDE
310430,3104,31,POTASSIUM SULFATE
310490,3104,31,"MINERAL OR CHEMICAL FERTILIZER, POTASSIC, NESOI"
310510,3105,31,PRODUCTS OF CHAPTER 31 IN TABLETS OR SIMILAR FORMS OR IN PACKAGES OF A GROSS WEIGHT NOT EXCEEDING 10 KG
310520,3105,31,"MINERAL OR CHEMICAL FERTILIZERS CONTAINING THE THREE FERTILIZING ELEMEMTS NITROGEN, PHOSPHORUS & POTASSIUM"
310530,3105,31,DIAMMONIUM HYDROGENORTHOPHOSPHATE (DIAMMONIUM PHOSPHATE)
310540,3105,31,AMMONIUM DIHYDROGENORTHOPHOSPHATE (MONOAMMONIUM PHOSPHATE)
310551,3105,31,MINERAL OR CHEMICAL FERTILIZERS CONTAINING NITRATES AND PHOSPHATES
310559,3105,31,OTHER MINERAL OR CHEMICAL FERTILIZERS CONTAINING THE TWO FERTILIZING ELEMENTS NITROGEN AND PHOSPHORUS
310560,3105,31,MINERAL OR CHEMICAL FERTILIZERS CONTAINING THE TWO FERTILIZING ELEMENTS PHOSPHORUS AND POTASSIUM
310590,3105,31,FERTILIZER OF POTASSIUM NITRATE-SODIUM NITRATE MIXTURES
320110,3201,32,QUEBRACHO EXTRACT
320120,3201,32,WATTLE EXTRACT
320190,3201,32,"TANNIC ACID, CONTAINING BY WEIGHT 50 PERCENT OR MORE OF TANNIC ACID"
320210,3202,32,"SYNTHETIC ORGANIC TANNING SUBSTANCES, AROMATIC OR MODIFIED AROMATIC"
320290,3202,32,"TANNING SUBSTANCES, CONSISTING WHOLLY OF INORGANIC SUBSTANCES"
320300,3203,32,"ANNATO, ARCHIL, COCHINEAL, CUDBEAR, LITMUS, LOGWOOD AND MARIGOLD MEAL"
320411,3204,32,"DISPERSE DYES AND PREPARATIONS BASED THERON,DISPERSE BLUE 19 ETC"
320412,3204,32,ACID BLACK 210 POWDER AND PRESSCAKE
320413,3204,32,"BASIC DYES AND PREPARATIONS BASED THEREON,BASIC BLACK 7,ETC"
320414,3204,32,"DIRECT DYES AND PREPARATIONS BASED THEREON,DIRECT BLACK 62,ETC"
320415,3204,32,"VAT DYES (INCLUDING THOSE USABLE IN THAT STATE AS PIGMENTS) AND PREPARATIONS BASED THEREON,VAT BLUE 1 (SYNTHETIC INDIGO)"
320416,3204,32,"REACTIVE DYES AND PREPARATIONS BASED THEREON,REACTIVE BLACK 1, ETC"
320417,3204,32,"PIGMENTS AND PREPARATIONS BASED THEREON, PIGMENT BLUE 16"
320418,3204,32,BETA-CAROTENE AND OTHER CAROTENOID COLORING MATTER
320419,3204,32,"SOLVENT YELLOW 43, 44, 85, 172"
320420,3204,32,FLUORESCENT BRIGHTENING AGENT 32
320490,3204,32,"SYNTHETIC ORGANIC COLORING MATTER,NESOI"
320500,3205,32,"CARMINE FOOD COLORING SOLUTIONS, CONT COCHINEAL CARMINE LAKE AND PAPRIKA OLEORESINS, NOT INCLUDING ANY SYNTHETIC ORGANIC COLORING MATTER"
320611,3206,32,PIGMENTS AND PREPARATIONS BASED ON TITANIUM DIOXIDE: CONTAINING 80 PERCENT OR MORE BY WEIGHT OF TITANIUM DIOXIDE CALCULATED ON THE DRY MATTER
320619,3206,32,"PIGMENTS AND PREPARATIONS BASED ON TITANIUM DIOXIDE, NESOI"
320620,3206,32,CHROME YELLOW
320641,3206,32,ULTRAMARINE AND PREPARATIONS BASED THEREON
320642,3206,32,LITHOPONE AND OTHER PIGMENTS AND PREPARATIONS BASED ON ZINC SULFIDE
320649,3206,32,CONCENTRATED DISPERSIONS OF PIGMENTS IN PLASTICS MATERIALS
320650,3206,32,INORGANIC PRODUCTS OF A KIND USED AS LUMINOPHORES
320710,3207,32,"PREPARED PIGMENTS,PREPARED OPACIFIERS,PREPARED COLORS AND SIMILAR PREPARATIONS"
320720,3207,32,"VITRIFIABLE ENAMELS AND GLAZES,ENGOBES (SLIPS) AND SIMILAR PREPARATIONS"
320730,3207,32,LIQUID LUSTRES AND SIMILAR PREPARATIONS
320740,3207,32,"GLASS FRIT AND OTHER GLASS,IN THE FORM OF POWDER,GRANULES OR FLAKES, GROUND OR PULVERIZED"
320810,3208,32,"PAINTS AND VARNISHES(INCL ENAMELS & LACQUERS)BASED ON SYNTHETIC POLYMERS,ETC IN A NONAQUEOUS MEDIUM,BASED ON POLYESTERS"
320820,3208,32,"PAINTS AND VARNISHES(INCL ENAMELS & LACQUERS)BASED ON SYNTHETIC POLYMERS,ETC,IN A NONAQUEOUS MEDIUM,BASED ON ACRYLIC OR VINYL POLYMERS"
320890,3208,32,"PAINTS AND VARNISHES(INCL ENAMELS & LACQUERS)BASED ON SYNTHETIC POLYMERS,ETC IN A NONAQUEOUS MEDIUM,NESOI"
320910,3209,32,"PAINTS AND VARNISHES(INCL ENAMELS & LACQUERS)BASED ON SYNTHETIC POLYMERS,ETC IN AN AQUEOUS MEDIUM,BASED ON ACRYLIC OR VINYL POLYMERS"
320990,3209,32,"PAINTS AND VARNISHES(INCL ENAMELS & LACQUERS)BASED ON SYNTHETIC POLYMERS,ETC IN AN AQUEOUS MEDIUM,NESOI"
321000,3210,32,"OTHER PAINTS AND VARNISHES (INCL ENAMELS,LACQUERS AND DISTEMPERS); PREPARED WATER PIGMENTS OF A KIND USED FOR FINISHING LEATHER"
321100,3211,32,PREPARED DRIERS
321210,3212,32,STAMPING FOILS
321290,3212,32,METALLIC ALUMINUM PIGMENTS
321310,3213,32,"ARTISTS' STUDENTS' OR SIGNBOARD PAINTERS COLORS,IN TUBES,JARS,ETC, COLORS IN SETS"
321390,3213,32,"ARTISTS' STUDENTS' OR SIGNBOARD PAINTERS COLORS,IN TUBES,JARS,ETC, NESOI"
321410,3214,32,CAULKING COMPOUNDS
321490,3214,32,"GLAZERS' PUTTY,GRAFTING PUTTY,RESIN CEMENTS,CAULKING COMPOUNDS,ETC, BASED ON RUBBER"
321511,3215,32,"PRINTING INK,BLACK, NEWS"
321519,3215,32,"PRINTING INK,OTHER THAN BLACK, NEWS"
321590,3215,32,DRAWING INK
330112,3301,33,ESSENTIAL CITRUS FRUIT OILS OF ORANGE
330113,3301,33,ESSENTIAL CITRUS FRUIT OILS OF LEMON
330119,3301,33,ESSENTIAL CITRUS FRUIT OILS OF GRAPEFRUIT
330124,3301,33,ESSENTIAL OILS OF PEPPERMINT (MENTHA PIPERITA)
330125,3301,33,"ESSENTIAL OILS OF CORNMINT, INCLUDING  PEPPERMINT  DERIVED FROM MENTHA ARVENSIS"
330129,3301,33,ESSENTIAL OILS OF EUCALYPTUS
330130,3301,33,RESINOIDS
330190,3301,33,PAPRIKA OLEORESIN
330210,3302,33,MIXTURES OF ODORIFEROUS SUBSTANCES USED IN THE FOOD OR DRINK INDUSTRIES NOT CONTAINING ALCOHOL
330290,3302,33,"PERFUME OIL MIXTURES & BLENDS, CONSISTING OF PRODUCTS READY FOR USE AS FINISHED PERFUME BASES CONTAINING NO ALCOHOL/NT OVER 10% OF ALCOHOL BY WEIGHT"
330300,3303,33,FLORAL OR FLOWER WATERS NOT CONTAINING ALCOHOL
330410,3304,33,LIP MAKE-UP PREPARATIONS
330420,3304,33,EYE MAKE-UP PREPARATIONS
330430,3304,33,MANICURE OR PEDICURE PREPARATIONS
330491,3304,33,ROUGES
330499,3304,33,PETROLEUM JELLY PUT UP FOR RETAIL SALE
330510,3305,33,SHAMPOOS
330520,3305,33,PREPARATIONS FOR PERMANENT WAVING OR STRAIGHTENING
330530,3305,33,HAIR LACQUERS
330590,3305,33,"PREPARATIONS FOR USE ON THE HAIR, NESOI"
330610,3306,33,DENTIFRICES
330620,3306,33,YARN USED TO CLEAN BETWEEN THE TEETH (DENTAL FLOSS)
330690,3306,33,"OTHER PREPARATIONS FOR ORAL OR DENTAL HYGIENE, INCLUDING DENTURE FIXATIVE PASTES AND POWDERS"
330710,3307,33,"PRE-SHAVE, SHAVING OR AFTER-SHAVE PREPARATIONS NOT CONTAINING ALCOHOL"
330720,3307,33,PERSONAL DEODORANTS AND ANTIPERSPIRANTS
330730,3307,33,"BATH SALTS, WHETHER OR NOT PERFUMED"
330741,3307,33,AGARBATTI AND OTHER ODORIFEROUS PREPARATIONS WHICH OPERATE BY BURNING
330749,3307,33,"PREPARATIONS FOR PERFUMING/DEODERIZING ROOMS, INCLUDING ODERIFEROUS PREPARATIONS USED DURING RELIGIOUS RITES"
330790,3307,33,"DEPILATORIES AND OTHER PERFUMERY, COSMETIC OR TOILET PREPARATIONS, NESOI"
340111,3401,34,CASTILE SOAP
340119,3401,34,"SOAP & OTHER ORGANIC SURF-ACT PRODUCTS,NOT FOR TOILET USE, IN BARS,CAKES, MOLDED PIECES, AND PAPER,ETC IMPREGNATED OR COATED WITH SOAP OR DETERGENT"
340120,3401,34,SOAP IN OTHER FORMS
340130,3401,34,"AROMATIC OR MODIFIED AROMATIC ORGANIC SURFACE-ACTIVE PRODS FOR WASHING THE SKIN, LIQUID OR CREAM, FOR RETAIL SALE, WHETHER OR NOT CONTAINING SOAP"
340231,3402,34,LINEAR ALKYLBENZENE SULFONIC ACIDS AND THEIR SALTS; AROMATIC OR MODIFIED AROMATIC
340239,3402,34,"AROMATIC OR MODIFIED AROMATIC ANIONIC ORGANIC SURFACE-ACTIVE AGENTS, WHETHER OR NOT PUT UP FOR RETAIL SALE, NESOI"
340241,3402,34,"AROMATIC OR MODIFIED AROMATIC CATIONIC ORGANIC SURFACE-ACTIVE AGENTS, WHETHER OR NOT PUT UP FOR RETAIL SALE"
340242,3402,34,"NONIONIC SURFACE-ACTIVE AGENTS,AROMATIC OR MODIFIED AROMATIC,WHETHER OR NOT PUT UP FOR RETAIL SALE"
340249,3402,34,"ORGANIC SURFACE ACTIVE AGENTS,OTHER,AROMATIC OR MODIFIED AROMATIC"
340250,3402,34,"PREPARATIONS CONTAINING ANY AROMATIC OR MODIFIED AROMATIC SURFACE-ACTIVE AGENT, PUT UP FOR RETAIL SALE"
340290,3402,34,SYNTHETIC DETERGENTS
340311,3403,34,"PREPARATIONS FOR THE TREATMENT OF TEXTILE MATERIALS, CONTAINING 50% OR MORE BY WEIGHT OF PETROLEUM OILS OR OF OILS OBTAINED FROM BITUMINOUS MINERALS"
340319,3403,34,"LUBRICATING PREPARATIONS,OTHER,CONTAIN GT=50% BY WEIGHT OF PETROLEUOILS OR OF OILS OBT  AINED FROM BITUMINOUS MINERALS"
340391,3403,34,"PREPARATIONS FOR TREATMENT OF TEXTILE MATERIALS,NESOI"
340399,3403,34,"LUBRICATING PREPARATIONS,NOT CONTAINING PETROLEUM OILS OR OILS OBTAINED FROM BITUMINOUS MINERALS, OTHER"
340420,3404,34,"ARTIFICIAL WAXES AND PREPARED WAXES,OF POLYETHYLENE GLYCOL"
340490,3404,34,ARTIFICIAL WAXES AND PREPARED WAXES CONTAINING BLEACHED BEESWAX
340510,3405,34,"POLISHES, CREAMS AND SIMILAR PREPARATIONS FOR FOOTWEAR OR LEATHER"
340520,3405,34,"POLISHES, CREAMS AND SIMILAR PREPARATIONS FOR THE MAINTENANCE OF WOODEN FURNITURE, FLOORS OR OTHER WOODWORK"
340530,3405,34,"POLISHES AND SIMILAR PREPARATIONS FOR COACHWORK,OTHER THAN METAL POLISHES"
340540,3405,34,SCOURING PASTES AND POWDERS AND OTHER SCOURING PREPARATIONS
340590,3405,34,"POLISHES AND CREAMS ETC, NESOI"
340600,3406,34,"CANDLES, TAPERS AND THE LIKE"
340700,3407,34,"MODELING PASTES, INCLUDING THOSE PUT UP FOR CHILDREN'S AMUSEMENT"
350110,3501,35,MILK PROTEIN CONCENTRATE
350190,3501,35,CASEIN GLUES
350211,3502,35,"EGG ALBUMIN, DRIED"
350219,3502,35,"OTHER EGG ALBUMIN, EXCEPT DRIED"
350220,3502,35,"MILK ALBUMIN, INCLUDING CONCENTRATES OF TWO OR MORE WHEY PROTEINS, CONTAINING BY WEIGHT MORE THAN 80 PERCENT WHEY PROTEINS, CALCULATED ON DRY MATTER"
350290,3502,35,"ALBUMINS, ALBUMINATES AND ALBUMIN DERIVATIVES, NESOI"
350300,3503,35,FISH GLUE
350400,3504,35,"PEPTONES AND THEIR DERIVATIVES; OTHER PROTEIN SUBSTANCES AND THEIR DERIVATIVES AND HIDE POWDER, WHETHER OR NOT CHROMED, NESOI"
350510,3505,35,"DEXTRINS, DERIVED FROM POTATO STARCH"
350520,3505,35,"GLUES BASED ON STARCHES, OR ON DEXTRINS OR OTHER MODIFIED STARCHES"
350610,3506,35,"ANIMAL GLUE, INCLUDING CASEIN GLUE, BUT NOT INCLUDING FISH GLUE FOR USE AS GLUES, PUT UP FOR RETAIL SALE AS GLUES, NOT EXCEEDING A NET WEIGHT OF 1 KG"
350691,3506,35,OPTICALLY CLEAR FREE-FILM ADHESIVES AND OPTICALLY CLEAR CURABLE LIQUID ADHESIVES OF A KIND USED SOLELY OR PRINCIPALLY FOR THE MANUFACTURE OF FLAT PANE
350699,3506,35,"PRODUCTS SUITABLE FOR USE AS ADHESIVES, PUT UP FOR RETAIL SALE AS ADHESIVES, NOT EXCEEDING A NET WEIGHT OF 1 KG, NESOI"
350710,3507,35,RENNET AND CONCENTRATES THEREOF
350790,3507,35,PENICILLIN G AMIDASE
360100,3601,36,PROPELLANT POWDERS
360200,3602,36,"DYNAMITE,OTHER HIGH EXPLOSIVES,PUT UP IN CARTRIDGES,STICKS OR OTHER FORMS, SUITABLE FOR BLASTING"
360310,3603,36,SAFETY FUSES
360320,3603,36,DETONATING FUSES
360330,3603,36,PERCUSSION CAPS
360340,3603,36,DETONATING CAPS
360350,3603,36,IGNITERS
360360,3603,36,ELECTRIC DETONATORS
360410,3604,36,CLASS 1.3G FIREWORKS
360490,3604,36,"SIGNALLING FLARES, RAIN ROCKETS, FOG SIGNALS AND OTHER PYROTECHNIC ARTICLES, NESOI"
360500,3605,36,MATCHES WITH NATURAL WOOD STEMS
360610,3606,36,LIQUID OR LIQUEFIED-GAS FUELS IN CONTAINERS OF A KIND USED FOR FILLING OR REFILLING CIGARETTE/SIMILAR LIGHTERS AND OF A CAPACITY NOT EXCEEDING 300 CM3
360690,3606,36,FERROCERIUM AND OTHER PYROPHORIC ALLOYS
370110,3701,37,"XRAY FILM FOR MEDICAL, OTHER THAN DENTAL IN FLAT"
370120,3701,37,INSTANT PRINT FILM FOR COLOR PHOTOGRAPHY (POLYCHROME) IN THE FLAT
370130,3701,37,"OTHER PLATES AND FILM, WITH ANY SIDE EXCEEDING 255 MM IN THE FLAT"
370191,3701,37,DISC FILM FOR COLOR PHOTOGRAPHY (POLYCHROME) IN THE FLAT
370199,3701,37,DRY PLATES OTHER THAN FOR COLOR PHOTOGRAPHY)(POLYCHROME) IN THE FLAT
370210,3702,37,"X-RAY FILM IN ROLLS FOR MEDICAL, OTHER THAN DENTAL"
370231,3702,37,"FILM, WITHOUT PERFORATIONS; OF A WIDTH NOT EXCEEDING 105 MM FOR COLOR PHOTOGRAPHY (POLYCHROME) IN ROLLS"
370232,3702,37,"MICROFILM, WITH SILVER HALIDE EMULSION WITHOUT PERFORATIONS; OF A WIDTH NOT EXCEEDING 105 MM IN ROLLS"
370239,3702,37,"FILM WITHOUT PERFORATIONS, OF A WIDTH NOT EXCEEDING 105 MM, EXCEPT WITH SILVER HALIDE EMULSION, IN ROLLS, NESOI"
370241,3702,37,"FILM, WITHOUT PERFORATIONS, OF A WIDTH EXCEEDING 610 MM AND OF A LENGTH EXCEEDING 200 M FOR COLOR PHOTOGRAPHY (POLYCHROME), NESOI"
370242,3702,37,"FILM WITHOUT PERFORATIONS OF A WIDTH EXCEEDING 610 MM AND OF A LENGTH EXCEEDING 200 MM, NOT USED FOR COLOR PHOTOGRAPHY, NESOI"
370243,3702,37,"FILM WITHOUT PERFORATIONS OF A WIDTH EXCEEDING 610 MM AND OF A LENGTH NOT EXCEEDING 200 M, NESOI"
370244,3702,37,"GRAPHIC ARTS FILM, WITHOUT PERFORATIONS, OF A WIDTH EXCEEDING 105 MM BUT NOT EXCEEDING 610 MM"
370252,3702,37,REVERSAL COLOR FILM OF A WIDTH NOT EXCEEDING 16 MM
370253,3702,37,"FILM FOR COLOR PHOTOGRAPHY (POLYCHROME) OF A WIDTH EXCEEDING 16MM BUT NT EXCEEDING 35MM & OF A LENGTH NT EXCEEDING 30M, FOR 35MM SLIDES"
370254,3702,37,"35 MM FILM FOR COLOR PHOTOGRAPHY OF A WIDTH EXCEEDING 16MM BUT NOT EXCEEDING 35 MM AND OF A LENGTH NOT EXCEEDING 30M, OTHER THAN FOR SLIDE"
370255,3702,37,REVERSAL COLOR FILM OF A WIDTH EXCEEDING 16MM BUT NOT EXCEEDING 35MM AND OF A LENGTH EXCEEDING 30 M
370256,3702,37,MOTION-PICTURE FILM OF A WIDTH EXCEEDING 35 MM FOR COLOR PHOTOGRAPHY
370296,3702,37,MONOCHROME PHOTOGRAPHY FILM OF A WIDTH NOT EXCEEDING 35 MM AND OF A LENGTH NOT EXCEEDING 30 M
370297,3702,37,MONOCHROME PHOTOGRAPHY FILM OF A WIDTH NOT EXCEEDING 35 MM AND OF A LENGTH EXCEEDING 30 M
370298,3702,37,MONOCHROME PHOTOGRAPHY FILM OF A WIDTH EXCEEDING 35 MM
370310,3703,37,"SILVER HALIDE PAPERS FOR PICTORIAL USE, FOR COLOR PHOTOGRAPHY IN ROLLS OF A WIDTH EXCEEDING 610 MM, UNEXPOSED"
370320,3703,37,"SILVER HALIDE PAPER FOR PICTORIAL USE, FOR COLOR PHOTOGRAPHY IN ROLLS OF A WIDTH LESS THAN 610MM, UNEXPOSED"
370390,3703,37,"SILVER HALIDE PAPER FOR PICTORIAL USE, IN SHEETS"
370400,3704,37,"PHOTOGRAPHIC PLATES, FILM, PAPER, PAPERBOARD AND TEXTILE, EXPOSED BUT NOT DEVELOPED"
370500,3705,37,"PHOTOGRAPHIC  PLATES AND FILM, EXPOSED AND DEVELOPED, OTHER THAN CINEMATOGRAPHIC FILM"
370610,3706,37,SOUND RECORDING ON MOTION-PICTURE FILM SUITABLE FOR USE IN CONNECTION WITH MOTION-PICTURE EXHIBITS OF A WIDTH OF 35 MM OR MORE
370690,3706,37,POSITIVE RELEASE PRINTS EXCEPT OF A WIDTH LESS THAN 35 MM
370710,3707,37,"SENSITIZING EMULSIONS, FOR USE IN COLOR NEGATIVE PHOTOGRAPHIC PAPER"
370790,3707,37,ACID VIOLET 19 FOR PHOTOGRAPHIC USES
380110,3801,38,"ARTIFICIAL GRAPHITE PLATES, RODS, POWDER AND OTHER FORMS FOR MANUFACTURING INTO BRUSHES FOR ELECTRIC GENERATORS, MOTORS OR OTHER MACHINES OR APPLIANCE"
380120,3801,38,COLLOIDAL/SEMI-COLLOIDAL GRAPHITE
380130,3801,38,CARBONACEOUS PASTES FOR ELECTRODES AND SIMILAR PASTES FOR FURNACE LININGS
380190,3801,38,"PREPARATIONS BASED ON GRAPHITE, NESOI"
380210,3802,38,ACTIVATED CARBON DERIVED FROM COAL
380290,3802,38,BONE BLACK
380300,3803,38,"TALL OIL, WHETHER OR NOT REFINED"
380400,3804,38,LIGNIN SULFONIC ACID AND ITS SALTS
380510,3805,38,"GUM, WOOD OR SULFATE TURPENTINE OILS"
380590,3805,38,PINE OIL
380610,3806,38,GUM ROSIN
380620,3806,38,"SALTS OF ROSIN, OF RESIN ACIDS OR OF DERIVATIVES OF ROSIN OR RESIN ACIDS, OTHER THAN SALTS OF ROSIN ADDUCTS"
380630,3806,38,ESTER GUMS
380690,3806,38,"RUN GUMS, NESOI"
380700,3807,38,"WOOD TAR, WOOD TAR OILS, WOOD CRESOTE, WOOD NAPHTHA, VEGETABLE PITCH, BREWERS' PITCH AND SIMILAR PREPARATIONS BASED ON ROSIN, RESIN ACIDS & VEG PITCH"
380852,3808,38,"DDT (ISO) (CLOFENATONE (INN)), IN PACKINGS OF A NET WEIGHT CONTENT NOT EXCEEDING 300 g"
380859,3808,38,GOODS SPECIFIED IN NOTE 1 TO CHAPTER 28 CONTAINING ANY AROMATIC OR MODIFIED AROMATIC PESTICIDES
380861,3808,38,GOODS SPECIFIED IN SUBHEADING NOTE 2 TO CH 38 CONTAINING ANY AROMATIC OR MODIFIED AROMATIC PESTICIDE IN PACK NOT OVER 300G
380862,3808,38,"INSECTICIDES CONTAINING ANY AROMATIC OR MODIFIED AROMATIC INSECTICIDE, IN PACKINGS OF NET WT EXC 300G BUT NOT 7.5KG, NESOI"
380869,3808,38,"GOODS SPECIFIED IN SUBHEADING NOTE 2 TO CH 38 CONTAINING ANY AROMATIC OR MODIFIED AROMATIC PESTICIDE, NESOI"
380891,3808,38,FLY RIBBONS (RIBBON FLY CATCHERS) FOR INSECTICIDES
380892,3808,38,MIXTRUES OF DINOCAP AND APPLICATION ADJUVANTS
380893,3808,38,"MIXTURES OF 2,6-DICHOLORBENZONITRILE AND INERTS;MIXTURES OF 3,5-DICHLORO-N(1,1-DIMETNYL-2-PROPYNYL)-BENZAMIDE (PRONAMIDE)AND APPLICATION ADJUVANTS;ETC"
380894,3808,38,DISINFECTANTS CONTAINING ANY AROMATIC OR MODIFIED AROMATIC DISINFECTANT
380899,3808,38,"MIXTURES OF 1,1-BIS(4-CHLOROPHENYL)-2,2,2-TRICHLOROETHANOL (DICOFOL) AND APPLICATION ADJUVANTS"
380910,3809,38,FINISHING AGENTS AND DYE CARRIERS WITH A BASIS OF AMYLACEOUS SUBSTANCES
380991,3809,38,"FINISHING AGENTS USED IN THE TEXTILE INDUSTRY OR LIKE INDUSTRIES, NESOI"
380992,3809,38,FINISHING AGENTS AND DYE CARRIERS USED IN THE PAPER INDUSTRY CONTAINING 5 PERCENT OR MORE BY WGT OF 1 OR MORE AROMATIC/MODIFIED AROMATIC SUBSTANCES
380993,3809,38,FINISHING AGENTS CONTAINING 5% OR MORE BY WEIGHT OF ONE OR MORE AROMATIC OR MODIFIED AROMATIC SUBSTANCES
381010,3810,38,"PICKLING PREPARATION FOR METAL SURFACES, SOLDERING, BRAZING OR WELDING POWDERS AND PASTES CONSISTING OF METAL AND OTHER MATERIALS"
381090,3810,38,"FLUXES AND OTHER AUXILARY PREPARATIONS FOR SOLDERING, BRAZING OR WELDING CONTAINING 5% OR MORE BY WGT OF ONE OR MORE AROMATIC/MODIFIED AROMATIC SUBST"
381111,3811,38,ANTIKNOCK PREPARATIONS BASED ON TETRAETHYL LEAD OR ON A MIXTURE OF TETRAETHYL LEAD AND TETRAMETHYL LEAD
381119,3811,38,"ANTIKNOCK PREPARATIONS, NESOI"
381121,3811,38,ADDITIVES FOR LUBRICATING OILS CONTAINING PETROLEUM OILS OR OILS OBTAINED FROM BITUMINOUS MINERALS
381129,3811,38,ADDITIVES FOR LUBRICATING OILS EXCEPT THOSE CONTAINING PETROLEUM OILS OR OILS OBTAINED FROM BITUMINOUS MINERALS
381190,3811,38,"ADDITIVES FOR LUBRICATING OILS, NESOI"
381210,3812,38,PREPARED RUBBER ACCELERATORS CONTAINING ANY AROMATIC OR MODIFIED AROMATIC RUBBER ACCELERATORS
381220,3812,38,COMPOUND PLASTICIZERS FOR RUBBER OR PLASTICS CONTAINING ANY AROMATIC OR MODIFIED AROMATIC PLASTICIZER
381231,3812,38,"COMPOUND PLASTICIZERS FOR RUBBER/PLASTICS MIXTURES OF OLIGOMERS OF 2,2,4-TRIMETHYL-1,2-DIHYDROQUINOLINE(TMQ)"
381239,3812,38,"MIXTURES OF N,N'-DIARYL-P-PHENYLENEDIAMINES"
381300,3813,38,PREPARATION & CHARGES FOR FIRE EXTINGUISHERS AND CHARGED FIRE-EXTINGUISHING GRENADES CONSISTING WHOLLY OF INORGANIC SUBSTANCES
381400,3814,38,"ORGANIC COMPOSITE SOLVENTS & THINNERS, NESOI PERPARED PAINT/VANISH REMOVERS CONT GT=5%  , BUT LT 25% WGT,GT=1 AROMT/MODIF AROMTIC SUBSTANCES"
381511,3815,38,SUPPORTED CATALYSTS: WITH NICKEL OR NICKEL COMPOUNDS AS THE ACTIVE SUBSTANCE
381512,3815,38,SUPPORTED CATALYSTS: WITH PRECIOUS METAL OR PRECIOUS METAL COMPOUNDS AS THE ACTIVE SUBSTANCE
381519,3815,38,"SUPPORTED CATALYSTS, NESOI"
381590,3815,38,"REACTION INITIATORS & REACTION ACCELERATOR CONSISTING OF INORGANIC SUBSTANCES OF BISMUTH, OF TUNGSTEN OF VANADIUM"
381600,3816,38,DOLOMITE RAMMING MIX
381700,3817,38,MIXED LINEAR ALKYLBENZENES
381800,3818,38,"GALLIUM ARSENIDE WAFERS, DOPED"
381900,3819,38,HYDRAULIC BRAKE FLUIDS
382000,3820,38,ANTIFREEZING PREPARATION AND PREPARED DEICING FLUIDS
382100,3821,38,VIRAL TRANSPORT MEDIA
382211,3822,38,MALARIA DIAGNOSTIC TEST KITS
382212,3822,38,"DIAGNOSTIC OR LABORATORY REAGENTS FOR ZIKA AND OTHER DISEASES TRANSMITTED BY MOSQUITOES OF THE GENUS AEDES, WHETHER OR NOT PUT UP IN THE FORM OF KITS"
382213,3822,38,BLOOD-GROUPING REAGENTS
382219,3822,38,DIAGNOSTIC OR LABORATORY REAGENTS CONTAINING ANTIGENS OR ANTISERA & METHYL CHLOROFORM OR CARBON TETRACHLORIDE OTHER THAN THOSE OF HEADING 3002 OR 3006
382290,3822,38,CERTIFIED REFERENCE MATERIALS AS DEFINED IN NOTE 2 TO CHAPTER 38
382311,3823,38,STEARIC ACID
382312,3823,38,OLEIC ACID
382313,3823,38,TALL OIL FATTY ACIDS CONTAINING LESS THAN 2% ROSIN
382319,3823,38,"INDUSTRIAL MONOCARBOXYLIC FATTY ACIDS; DERIVED FROM COCONUT, PALM-KERNEL OR PALM OIL"
382370,3823,38,OLEYL ALCOHOL
382410,3824,38,PREPARED BINDERS FOR FOUNDRY MOLDS OR CORES
382430,3824,38,NONAGGLOMERATED METAL CARBIDES MIXED TOGETHER OR WITH METALLIC BINDERS
382440,3824,38,"PREPARED ADDITIVES FOR CEMENTS, MORTARS OR CONCRETES CONTAINING GT=5% BY WGT OF 1 OR MORE AROMATIC OR MODIFIED AROMATIC SUBSTANCES"
